Date,headline,Ticker
2022-04-14,"TCS, Infosys hired 1.85 lakh freshers in FY22 amid 'Great Resignation' - Fortune India",INFY
2022-04-20,Markets bounce back after five-day rout; Sensex jumps 574 points - The Indian Express,INFY
2022-04-20,"IT employees union files complaint against Infosys, seeks removal of non-compete clause - Moneycontrol.com",INFY
2022-04-13,"News in Infographics: Infosys Q4FY22 results, stock market holidays & more - Business Today",INFY
2022-05-05,"Delhivery Balance Sheets, Financial Statements - The Economic Times",INFY
2022-05-27,Sensex and Nifty rally over 1% amid firm global trends - The Indian Express,INFY
2022-05-17,LIC becomes fifth largest firm by market cap post market debut - Business Today,INFY
2022-05-31,Stock Market LIVE Updates: Sensex and Nifty50 likely to open lower today ahead of GDP data — track SGX futures - CNBC TV18,INFY
2022-05-18,LIC shares list at a discount - The Economic Times,INFY
2022-06-01,Motilal Oswal Gives A Buy Rating To This IT major For Potential Gain Of 35% - Goodreturns,INFY
2022-05-02,"Share market update: Are BSE, NSE open tomorrow? - Business Today",INFY
2022-06-30,"IT Q1 Preview | Strong revenue growth likely, margin pressure seen with high attrition rates - Moneycontrol.com",INFY
2022-07-24,Infosys: Industry leading revenue growth in Q1 lays robust foundation for the year - PR Newswire,INFY
2022-07-25,TCS vs Infosys vs HCL Tech: Who wins the top prize in Q1 earnings? - Moneycontrol.com,INFY
2022-07-25,"Share Market Today: Sensex falls 306 points, Nifty ends at 16,631; RIL, auto stocks drag - The Indian Express",INFY
2022-07-17,Sebi approves appointment of BSE's Ashish Chauhan as next CEO of NSE: ET Now - The Economic Times,INFY
2022-07-26,"Infosys, Hindustan Unilever, Axis Bank ने गिराया बाजार, 500 अंक लुढ़का Sensex - AajTak",INFY
2022-07-28,"Bajaj Finance, Bajaj Finserv, Tata Steel के शेयर बने रॉकेट...1000 अंक से ज्यादा चढ़ा Sensex - AajTak",INFY
2022-08-16,INFY Forecast — Price Target — Prediction for 2027 - TradingView,INFY
2022-08-28,₹1 lakh turns to ₹9.58 crore as IT stock issues bonus shares 5 times since 2000 - Mint,INFY
2022-08-25,"closing bell | Nifty, Sensex end in the red, Infosys, HDFC Bank, TCS fall - CNBC TV18",INFY
2022-08-10,These are the top 10 companies with highest FPI holding in Q1 - The Times of India,INFY
2022-08-11,"IT, Banking स्टॉक्स से बाजार में बहार... रॉकेट बने Axis Bank, Bajaj Finance, HDFC के शेयर - AajTak",INFY
2022-08-15,India's 75th Independence: 5 most valued stocks in the last 7 decades - Mint,INFY
2022-09-15,Infosys vs Wipro vs TCS: Which stock can beat the slowdown blues? - Business Today,INFY
2022-09-13,Infosys collaborates with Bpost (Belgium Post) to Improve Security for Postal Services Experiences - PR Newswire,INFY
2022-09-20,"Financial, IT Stocks Gave Sensex and Nifty Rise Ahead of Fed Rate Decision - Equitypandit",INFY
2022-09-14,SBI becomes third Indian lender to surpass Rs 5 trillion market cap - Moneycontrol.com,INFY
2022-09-15,Bears crawl back - Upstox,INFY
2022-09-23,"1986-2032: BSE 30 Companies - Then, Now and Beyond - Equitymaster",INFY
2022-10-17,Infosys has beaten TCS 5 times in 9 quarters in revenue growth - Mint,INFY
2022-10-14,Infosys: Broad based growth in H1 of 20.1 per cent in constant currency; Q2 margins expand 150 bps sequentially - ANI News,INFY
2022-11-01,"Share Market Today News: Sensex rises 375 points, Nifty ends near 18,150-mark on positive global cues, economic data - The Indian Express",INFY
2022-10-17,"How TCS, Wipro, Infosys, and HCLTech fared in Q2FY23 - Moneycontrol.com",INFY
2022-10-17,Wipro shares tank 9% in 3 days following Q2 result announcement - The Economic Times,INFY
2022-10-13,Who owns the Indian stock exchanges? - Business Today,INFY
2022-10-14,Friday fever - Upstox,INFY
2022-10-14,"Share Market Today News: Sensex surges 685 points, Nifty ends at 17,186 led by IT, financial stocks - The Indian Express",INFY
2022-10-14,Share market update: Most active stocks of the day in terms of traded value - The Economic Times,INFY
2022-10-25,Rishi Sunak's wife Akshata earned Rs 126.6 cr dividend income from Infosys in 2022 - The Economic Times,INFY
2022-10-27,"Infosys ex-dividend date: IT major stocks trade ex-dividend today, up 1% | Infosys Share Dividend Record Date 2022 - Zee Business",INFY
2022-10-04,"Stocks to buy today, October 4: HCL Tech, TCS, Infosys, Vedanta and Paytm among top 20 picks for profitable trade - Zee Business",INFY
2022-10-06,Top Stocks Under Rs 1500 to add to your watchlist – Detailed Analysis - Trade Brains,INFY
2022-10-10,How to make money in a volatile market? Here are a few tips - Business Today,INFY
2022-10-25,"Meet Akshata Murty, UK PM Rishi Sunak’s millionaire wife and Infosys' Narayana Murthy's daughter - Business Today",INFY
2022-12-01,"Britannia most-loved, Divi’s Labs shunned by analysts in November - Moneycontrol.com",INFY
2022-11-22,Ahead of Market: 10 things that will decide D-St action on Wednesday - The Economic Times,INFY
2022-11-03,"HDFC reports robust numbers, tech stocks tumble & more - Upstox",INFY
2022-11-30,Nifty December futures trade at premium - Business Standard,INFY
2022-11-22,"Stock Market Snaps 3-Day Losing Run: Sensex Climbs 274 Points, Nifty Ends Near 18,250 - ABP News",INFY
2022-12-07,"Stocks in focus: Infosys, HDFC AMC and more - The Economic Times",INFY
2022-12-09,"Share Market Today: Sensex crashes 389 points, Nifty settles below 18,500-mark weighed by IT stocks - The Indian Express",INFY
2022-12-15,Year-end special: IT stocks end 5-year winning run as 2022 turns worst since 13 years - The Economic Times,INFY
2022-12-23,Top IT Stocks in 2023 - Best IT Stocks In Indian Stock Market - Trade Brains,INFY
2023-01-26,Three 1:1 bonus shares: IT stock turns ₹1 lakh to ₹2.75 crore in 20 years - Mint,INFY
2023-01-06,Why Infosys Share Price is Falling - Equitymaster,INFY
2023-01-10,"Sensex tanks over 600 points: Rs 2L cr investor wealth lost; HDFC twins, Infosys, TCS top drags - Business Today",INFY
2023-01-27,How Infosys' 1:1 Bonus Shares Policy Turns A Stock From A Lakh To Rs 2.75 Cr In 20 Years - News18,INFY
2023-01-23,Sensex spurts over 400 points to trade at 61K level; Nifty rises 118 points - The New Indian Express,INFY
2023-01-20,"Nureca shares rebound 25% from day's low amid heavy volumes, up 17% - Business Today",INFY
2023-01-16,"Adani Green Energy shares jump 9% today; target of Rs 2,300 possible in near term? - Business Today",INFY
2023-01-25,Markets to shift to T+1 settlement from January 27; here’s all you need to know - Business Today,INFY
2023-02-21,Indore Municipal Corporation green bonds listed on NSE - The Economic Times,INFY
2023-02-22,TCS vs Infosys vs HCL Tech: Which large-cap IT stock could deliver better returns in near term? - Business Today,INFY
2023-02-23,"TCS, Infosys shares: What a soft 2023 revenue guidance by Capgemini suggests - Business Today",INFY
2023-02-15,Infosys' revenue growth in FY23 likely to be better than TCS: Moody’s - Business Today,INFY
2023-03-23,Kiran Mazumdar-Shaw to retire from Infosys board; D Sundaram appointed lead Independent Director - The Economic Times,INFY
2023-03-20,"TCS, Infosys Wipro: How Credit Suisse, SVB collapse can impact Indian IT sector - Business Today",INFY
2023-03-18,"Big shake up in India's IT sector: Top bosses of TCS, Infosys resign amid recession fears - The Economic Times",INFY
2023-03-11,Infosys' ex-President Mohit Joshi appointed as MD & CEO of Tech Mahindra; will replace CP Gurnani - The Economic Times,INFY
2023-03-11,Infosys President Mohit Joshi resigns - Business Today,INFY
2023-03-31,"Sensex finishes FY23 in style, settles 1,031 pts higher; Nifty tops 17,350; Sonata Software, BCG & RIL rise up to 11% - Business Today",INFY
2023-04-17,"Infosys stock hits new 52-week low, ends at ₹1,259 on NSE down over 9% as investors lose ₹58,000 crore - Mint",INFY
2023-04-17,Track Record: Infosys shares log worst single-day loss since 2019 - The Economic Times,INFY
2023-04-17,"Time travel through Infosys' growth story: From Rs 100 to Rs 1,250 in 23 Years and Counting - Business Today",INFY
2023-04-03,"Sensex, Nifty Fall As Infosys, ITC, TCS Drag: Mid-Day Market Update - NDTV Profit",INFY
2023-04-18,"Infosys falls over 9%; mcap declines by Rs 59,349 crore - Ahmedabad Mirror",INFY
2023-04-13,Infosys Q4 earnings lower-than-estimates. How will stock price react on Monday? - Mint,INFY
2023-04-04,Infosys is down 7% so far this year; here's what analysts say ahead of Q4 results - Business Today,INFY
2023-04-18,"Rishi Sunak’s wife, Akshata Murty, loses $61 million from Infosys woes in a day - The Economic Times",INFY
2023-04-17,"Infosys shares hit lower circuit: LIC, Murthy family lost big within seconds. Here're key details - Business Today",INFY
2023-04-14,Infosys warns of trouble in key finance sectors - Mint,INFY
2023-04-04,JP Morgan puts HCL on 'negative catalyst watch' ahead of Q4 results - The Economic Times,INFY
2023-04-13,"Infosys Q4 results: Profit up 7.8%; Rs 17.50 dividend announced; FY24 guidance, attrition & other key takeaways - Business Today",INFY
2023-04-18,"Avalon Technologies muted D-St debut, shares list at Rs 431; what should investors do? - Business Today",INFY
2023-04-23,"TCS Vs Infosys – Future Plans, Profitability & Company Analysis - Trade Brains",INFY
2023-04-14,"Stock Market Holiday: BSE, NSE to remain closed for on Ambedkar Jayanti - Free Press Journal",INFY
2023-04-17,"TCS, Infosys or HDFC Bank: Which company has the best history of rewarding its shareholders? - Zee Business",INFY
2023-05-12,"South Indian Bank, YES Bank, Tata Steel shares see surge in volumes; Tata Motors, Infosys stocks see high turnovers - Business Today",INFY
2023-05-23,Launched today: Infosys Topaz - An AI-first offering to accelerate business value for global enterprises using generative AI - PR Newswire,INFY
2023-05-15,Infosys allots Rs 64 crore worth of shares to employees. When can they sell the shares? - The Economic Times,INFY
2023-05-08,"LIC portfolio shares: Reliance Industries, ITC, TCS, Infosys & SBI among insurer's top stock holdings - Business Today",INFY
2023-05-10,Why Oracle Financial Share Price is Falling - Equitymaster,INFY
2023-05-26,Crack the code of profitable trading with India's top 5 women traders - The Economic Times,INFY
2023-05-05,"3 takeaways from IT sector Q4 results. Infosys, HCL Tech best stock picks, says Kotak - Business Today",INFY
2023-05-08,Bank of India shares plunge 9% as NPAs rise in Q4 - The Economic Times,INFY
2023-05-15,Infosys allots 5.11 lakh shares to staff under ESOP - Zee Business,INFY
2023-05-23,Infosys launches Infosys Topaz - an AI-First offering: Check details - Zee Business,INFY
2023-06-01,Ex-Infosys executive Nitesh Bansal appointed as CEO of IT company R Systems - Business Today,INFY
2023-05-08,"Hot stocks next week: Canara Bank, Aarti Industries, Welspun India, Coforge and more stocks in focus - Business Today",INFY
2023-05-03,Jhunjhunwala Portfolio Stock: This Tata Group share hits all-time high; should you buy? - Business Today,INFY
2023-05-05,"HDFC Bank, HDFC share price tanks as MSCI assigns lower weight for merged entity; check details - Business Today",INFY
2023-06-09,Infosys shares can deliver up to 18% return despite near-term weakness — should you buy? - CNBC TV18,INFY
2023-06-12,NSE INFOSYS – Is This The Last Dip Before The Bull Charge? - Moneymunch,INFY
2023-06-23,"Infosys shares at Rs 1,200 or Rs 1,400? Here's what short-term technical analysis hints - Business Today",INFY
2023-06-14,Stock market update: Stocks that hit 52-week lows on NSE - The Economic Times,INFY
2023-06-06,"Buzzing stocks on June 6, 2023: Nelco, Mazagon Dock, Sharda Cropchem, Meghmani Finechem, others - Business Today",INFY
2023-06-19,Gift Nifty to be accessible for trading for 21 hours on NSE IX from Jul 3 - The Economic Times,INFY
2023-06-27,"Hot stocks on June 27, 2023: Delta Corp, Time Technoplast, RattanIndia Power, Brightcom Group and more - Business Today",INFY
2023-06-14,3i Infotech shares climb over 5% after subsidiary signs MoU to set up AI lab - The Economic Times,INFY
2023-06-07,"Adani Power, Adani Transmission and 2 other group stocks rise as BSE, NSE raise circuit limits - Business Today",INFY
2023-06-15,"Wipro share buyback: Record day tomorrow, double-digit return possible? - The Economic Times",INFY
2023-06-13,7 oversold stocks with RSI below 30: Potential opportunities for savvy investors - The Economic Times,INFY
2023-06-21,"Mazagon Dock market cap crosses Rs 25,000 crore. First ship-building company to achieve feat - The Economic Times",INFY
2023-06-27,Stock market update: Nifty IT index advances 0.22% in an upbeat market - The Economic Times,INFY
2023-06-23,ideaForge Technology IPO: Infosys to make 6x gains in drone maker on listing. Here's how - Business Today,INFY
2023-06-06,"IT stocks: Weak EPAM guidance sends Persistent, Mphasis, Coforge, Cyient shares falling; TCS, Infosys down 2% each - Business Today",INFY
2023-06-22,"Infosys, TCS, Accenture: WFH culture forcing IT companies to enter Tier II, Tier III cities - Business Today",INFY
2023-06-14,"After TCS, Infosys and Wipro, Capgemini partners with Google Cloud to expand generative AI suite - Business Today",INFY
2023-06-27,"Buzzing stocks on June 27, 2023: Paytm, HDFC Life, Aavas Financier, Zomato, others - Business Today",INFY
2023-07-21,Infosys share fall: Rishi Sunak's wife Akshata Murty's net worth dips ₹412 crore in one hour - Mint,INFY
2023-07-28,"Infosys shares down 12% in 2023 so far; what's next: Rs 1,250 or Rs 1,450? - Business Today",INFY
2023-07-22,Infosys tanks 7.7% on downgrades; leads sell-off in the IT world - The Economic Times,INFY
2023-07-06,"Midcap, smallcap frenzy sends 4 in 10 Nifty 500 stocks 50% down from record highs - Moneycontrol.com",INFY
2023-07-19,"Stock Market Highlights: Sensex, Nifty 50 end at record closing highs, Reliance near all-time high - CNBC TV18",INFY
2023-07-20,Infosys shares brace for steep fall as ADR plunges on NYSE in pre-market session - Business Today,INFY
2023-07-19,Infosys Q1 Preview: 6 key things to track - The Economic Times,INFY
2023-07-20,"Reliance Industries, Infosys, HCL Technologies, HUL, TCS, others among stocks to watch on July 20, 2023 - Business Today",INFY
2023-07-21,"Gainers and Losers: Infosys, Utkarsh SFB among 5 top stocks hogging limelight today - The Economic Times",INFY
2023-07-18,"Gainers and Losers: Infosys, Polycab India among 5 top stocks hogging limelight today - The Economic Times",INFY
2023-07-06,Hindalco Share Price Live blog for 06 Jul 2023 | Stock Market News - Mint,INFY
2023-07-14,"Should you buy, sell or hold Wipro shares post Q1 results? - Fortune India",INFY
2023-07-21,"Infosys, TCS, Wipro: Hiring, employee headcount fall across major Indian IT companies in Q1 FY24 - Business Today",INFY
2023-07-10,"Cyient DLM shares surge 54% to Rs 409 on NSE after bumper listing; should you book profits, hold or buy? Check share price target, stop loss, and more - Business Today",INFY
2023-07-07,Hindalco Share Price Live blog for 07 Jul 2023 | Stock Market News - Mint,INFY
2023-07-14,"IT stocks send market to the moon: Sensex settles above 66k for first time; TCS, Infosys jump up to 5% - Business Today",INFY
2023-07-04,Another C-suite reshuffle at Infosys; Sushanth Tharappan to replace current HR head Richard Lobo - Business Today,INFY
2023-08-24,Infosys Onboards Tennis Icon Rafael Nadal as Ambassador for the Brand and Infosys' Digital Innovation - PR Newswire,INFY
2023-08-16,"Stock market today: Nifty, Sensex end higher; Apollo Hospitals, Infosys top gainers; Tata Steel, HDFC Life top losers; IRFC, Religare, other stocks that buzzed in trade on August 16, 2023 - Business Today",INFY
2023-08-22,These largecaps have ‘strong buy’ & ‘buy’ recos and upside potential of more than 20% - The Economic Times,INFY
2023-08-15,"Stock market holiday: BSE, NSE to remain closed today on account of Independence Day - CNBC TV18",INFY
2023-08-11,"Stock markets decline for 2nd day on losses in private banks, weak global trends - The New Indian Express",INFY
2023-08-15,"Stock market holiday: BSE, NSE to remain closed today on account of Independence Day - Business Today",INFY
2023-08-31,MTAR Technologies shares jump 6% after company bags defense industrial license - The Economic Times,INFY
2023-08-02,Sensex dives over 700 points: Rs 2.6L cr investor wealth lost; Redington & Engineers India down up to 6% - Business Today,INFY
2023-08-21,"Jio Financial shares list at Rs 265 on BSE and Rs 262 on NSE. Should you buy, sell or hold? - The Economic Times",INFY
2023-08-12,"Top stocks of the week ended August 11, 2023: Gland Pharma, JSW Energy, Jubilant Pharmova, Kalyan Jewellers, Mahanagar Gas, others - Business Today",INFY
2023-08-03,"Vedanta, IRFC, Reliance Power, Suzlon Energy shares top volume chart on NSE - Business Today",INFY
2023-08-02,"IRFC, Reliance Power, Suzlon Energy, YES Bank shares lead volume chart on NSE - Business Today",INFY
2023-08-27,India achieved in 9 years what would have taken 47 years by traditional means: Nandan Nilekani - Business Today,INFY
2023-09-27,"Morgan Stanley raises Infosys, TCS, HCL Tech target prices; check the ratings - Moneycontrol.com",INFY
2023-09-21,"Stocks in focus: HFCL, Infosys and more - The Economic Times",INFY
2023-09-12,"Share Market Highlights 12 September 2023: Sensex edges 94 pts higher, Nifty nears 19,990; TCS, L&T, Infosys gain - BusinessLine",INFY
2023-09-23,"Top stocks of the week: Berger Paints, Power Finance, Union Bank, Indian Bank, HDFC Bank & others - Business Today",INFY
2023-09-29,"Infosys, Wipro, TechM, TCS: IT stocks in focus as Accenture shares yearly guidance. Analyst views - Business Today",INFY
2023-10-12,"Share Market Highlights 12 October 2023: Sensex falls marginally; Nifty below 19,800; Infosys, Tech Mahindra among major losers - BusinessLine",INFY
2023-10-10,"Sensex, Nifty Advance Led By Bharti Airtel, Infosys: Midday Market Update - NDTV Profit",INFY
2023-10-13,Infosys order book sets pace for FY25 growth; this year's guidance cut mars robust Q2 - Moneycontrol.com,INFY
2023-10-12,"Jio Financial, Adani Power, Tata Motors, RIL, Adani Green, Infosys shares: What MFs bought & sold in Sept - Business Today",INFY
2023-10-13,"Gainers & Losers: HCL Tech, SpiceJet among 6 stocks that hogged limelight on Friday - The Economic Times",INFY
2023-10-19,Multibagger stock: Narayan Murthy-backed company buys stake in Gokaldas Exports during Q2. Shares close to record high - Mint,INFY
2023-10-25,"Infosys shares to turn ex-dividend today; payment date, dividend history & more - Business Today",INFY
2023-10-14,"TCS, Infosys & HCL headcounts shrink by over 16,000 in Q2 - Business Today",INFY
2023-10-07,"Top stocks of the week: Prestige Estates, Godrej Properties, Paytm, L&T Finance Holdings, IndiGo & more - Business Today",INFY
2023-10-12,"Infosys announces 360% dividend — check out record date, payout date - Zee Business",INFY
2023-10-25,Infosys dividend record date 2023 today; shares to trade ex-date - Zee Business,INFY
2023-10-13,"Infosys, Wipro shares lagged behind TCS in two years; what's next for the stock of IT giant? - Business Today",INFY
2023-10-13,"HCL Tech follows Infosys, cuts FY24 guidance. Can its shares sustain 2023 gains? - Business Today",INFY
2023-10-13,"Top 10 stocks to watch on October 13, 2023: IRCON, RITES, HDFC Life, RMC Switchgears, Sun Pharma & more - Business Today",INFY
2023-10-25,"Sensex, Nifty extend fall: Rs 15 lakh crore investor wealth lost in 5 sessions; Bectors Food, JSW Energy down up to 9% - Business Today",INFY
2023-10-25,"Apollo Hospitals, Adani Enterprises top losers on Nifty50 amid market selloff; HDFC Bank, Reliance Industries most active stocks on October 25, 2023 - Business Today",INFY
2023-10-26,"FIRST TRADE: Sensex down over 300 pts; Nifty slips below 19,000 amid broad-based selling - Zee Business",INFY
2023-11-03,"Infosys Expands Its Footprint in Europe with a New Proximity Center in Sofia, Bulgaria to Help Accelerate AI and Cloud-led Digital Journeys for Clients in the Region - PR Newswire",INFY
2023-11-06,"Stocks To Watch: Tata Steel, Infosys, Indian Oil, InterGlobe Aviation, JSW Infrastructure, P&G Health - NDTV Profit",INFY
2023-11-09,"Adani Enterprises, HUL, Adani Ports top losers on Nifty50; RIL, HDFC Bank, ICICI Bank most active stocks on November 9, 2023 - Business Today",INFY
2023-11-07,Thematic ETFs: Low on liquidity but worth a look - Moneycontrol.com,INFY
2023-12-01,"Flair Writing share price makes stellar debut, stock lists with 65% premium at ₹501 on NSE - Mint",INFY
2023-12-14,"Infosys, TCS to HCL Tech: Why IT stocks are skyrocketing after US Fed meeting? - Mint",INFY
2023-12-11,Jayesh Sanghrajka named Infosys CFO as Nilanjan Roy resigns - The Economic Times,INFY
2023-12-05,Infosys Topaz Accelerates Spotlight Retail Group's Customer Growth in Digital Commerce - aap.com.au,INFY
2023-12-13,HPL Electric and Power bags smart meter orders worth Rs 545 crore - Business Standard,INFY
2023-12-25,"Stock Market Holiday: BSE, NSE to remain closed today on account of Christmas - Mint",INFY
2023-12-14,IRCTC share price hits 52-week high. Experts see more upside - Mint,INFY
2023-12-14,"Stock Market Today: Bull Run On Dalal Street. Sensex Surges Over 900 Points Nifty Around 21,100. IT Leads - ABP News",INFY
2023-12-22,"Dabur India shares down 5% in 2023. What Nuvama says on Q3, stock price target - Business Today",INFY
2024-01-12,"Infosys shares surge 7% after Q3 results. Should you buy, sell or hold? - India Today",INFY
2024-01-12,"IT stocks power Indian shares to new highs, weekly gains - Reuters",INFY
2024-01-19,"Stock market today: Infosys share price touches 52-week high. Buy, hold or book profit? - Mint",INFY
2024-01-11,US-based Capital Group sells Polycab India's shares worth Rs 337 crore - Business Standard,INFY
2024-01-06,"BSE, NSE holidays in 2024: Investors to enjoy 4 long weekends in first three months - The Economic Times",INFY
2024-01-14,Azim Premji turned down my job application: Narayana Murthy on the Infosys journey - Business Today,INFY
2024-01-19,"Is stock market open tomorrow? BSE, NSE to conduct special live trading session on Jan 20 - Mint",INFY
2024-01-18,NSE world's largest derivatives exchange for fifth year in a row; third in equity - The Economic Times,INFY
2024-01-20,"Top stocks of the week: IRFC, Rail Vikas Nigam, ONGC, Polycab India and more - Business Today",INFY
2024-01-11,"Infosys Q3 results: Profit down 7.3%, FY24 guidance revised; management commentary, key takeaways - Business Today",INFY
2024-01-12,"Sensex, Nifty hit fresh all-time highs; investor wealth jumps over Rs 2.76L cr - Business Today",INFY
2024-01-15,"Market at all-time high: Sensex jumps over 600 points; Nifty trades above 22,050 - Business Today",INFY
2024-02-22,This PSU Giant Surpasses Infosys In Market Cap To Rank 5th; Achieves Best Monthly Return in 3 Years - Goodreturns,INFY
2024-02-13,Infosys signs multi-year contract with Singaporian shipping firm Pacific International Lines for digital transformation - Business Today,INFY
2024-02-05,Earnings Calendar: Week of 5 February 2024 - Upstox,INFY
2024-02-27,What Is the Weightage of Nifty 50 Stocks and How Can It Guide Your Investment Choices? - GETMONEYRICH,INFY
2024-02-22,"Wipro shares recover 40% from October lows, is the upside capped? - Business Today",INFY
2024-02-13,RIL Becomes First Indian Company To Touch Rs 20 Lakh Cr Market Capitalisation - Kashmir Observer,INFY
2024-02-01,"Half Yearly Results, Half yearly Earnings for Alpex Solar - The Economic Times",INFY
2024-02-06,"Stock market today: Sensex jumps 243 points, Nifty soars to 21,844 - India TV News",INFY
2024-02-22,"Top 10 Indian companies by market cap: Reliance, TCS lead the pack - financialexpress.com",INFY
2024-02-22,"This ex-Infosys employee quit his US job, returned and co-founded a $3 billion startup - Business Today",INFY
2024-02-12,Stock Market Gainers And Losers Today - ABP News,INFY
2024-03-22,"IT shares sink as Accenture cuts guidance; TCS, Infosys and HCLTech fall - Business Standard",INFY
2024-03-15,Infosys Stocks Live Updates: Infosys Shares Close at Rs 1653.3 with -1.38% 1-Month Return - The Economic Times,INFY
2024-03-19,Who is the four-month-old child who owns shares worth ₹240 crore - The Hindu,INFY
2024-03-26,Mankind Pharma shares drop 4% after 1.3 crore shares change hands in a block deal - Upstox,INFY
2024-03-30,"Stock market holidays in April 2024: NSE, BSE to remain shut on these two days - Mint",INFY
2024-03-19,"Millionaire grandchildren! Not just Narayana Murthy's grandson, these Infosys co-founders' grandkids also - The Times of India",INFY
2024-03-27,"Nifty 50, other indices rejig tomorrow: Shriram Finance, HDFC Bank, Jio Finance, Adani Power to see highest inflows - Mint",INFY
2024-03-19,"Electoral bonds: Infosys among 3 IT companies that donated to political parties, Cyient largest donor - Business Today",INFY
2024-03-21,"Krystal Integrated Services share price dips after listing at 11% premium on BSE. Buy, sell or hold? - Mint",INFY
2024-04-01,"Infosys Dividend 2024: IT company to announce Q4 FY24 results soon, may recommend final dividend - Check share price target - Zee Business",INFY
2024-03-18,"Stock Market Closing March 18: Indices End Day In Green; Sensex At 72,748.42, Nifty Above 22,000; Tata Steel - Free Press Journal",INFY
2024-04-19,Infosys shares trade lower after Q4 results 2024. Buy or sell? - Mint,INFY
2024-04-10,"Q4 earnings season: TCS, Infosys, Bajaj Auto among 88 companies to announce results in April - Upstox",INFY
2024-04-26,"Global markets, US yield, Q4 results to set Sensex, Nifty trend on April 26 - Business Standard",INFY
2024-04-11,Are Indian stock markets NSE & BSE open today for trading? - The Economic Times,INFY
