Date,headline,Ticker
2025-06-26,"Stock Market Highlights 26th June 2025: Markets rise 1.21%; Sensex rises 1,000 pts to close at 83,755 pts; Nifty at 25,549 pts - BusinessLine",M&M
2025-06-18,"Stock Market Live Updates 18 June 2025: Sensex, Nifty end in red for second day amid global uncertainties - BusinessLine",M&M
2025-06-19,"Share Market Today Highlights 19 June 2025: Sensex, Nifty end lower for 3rd day on mounting geopolitical tensions - BusinessLine",M&M
2025-06-25,"Share Market Highlights 25th June 2025: Markets log gains for 2nd day; Sensex, Nifty surge nearly 1% on global rally - BusinessLine",M&M
2025-06-13,"Stock Market Highlights 13 June 2025: Sensex, Nifty 50 off day’s low; banking, financial & metal stocks drag amid Middle East tensions; gold hits record high - BusinessLine",M&M
2025-06-10,"Share Market Highlights 10th June 2025: Sensex snaps 4-day rally, Nifty ends unchanged in volatile trade - BusinessLine",M&M
2025-06-02,"Stock Market Highlights 2 June 2025: Equity benchmarks closed Monday’s session with marginal losses as investors remained cautious amid escalating geopolitical tensions between Russia and Ukraine, though broader market segments demonstrated resilie - BusinessLine",M&M
2025-06-09,"Share Market Highlights 9th June 2025: Stock markets rise for 4th day on global rally, gains in banking shares after RBI rate cut - BusinessLine",M&M
2025-06-30,Share Market Highlights 30th June 2025: Markets fall after 4-day rally dragged by bank stocks; Sensex drops 452 points - BusinessLine,M&M
2025-06-23,"M&M, Kfin Technologies, DMart among 3 stock picks by HDFC Securities - Business Today",M&M
2025-06-27,"NSE Indices Rejig: NTPC, ICICI Bank to grab major chunk of inflows; BEL, M&M, Eternal to see outflows on rebalancing - Mint",M&M
2025-07-01,"Stock Market Highlights 1 July 2025: Sensex, Nifty close higher on buying in Reliance, HDFC Bank - BusinessLine",M&M
2025-06-06,"Share Market Highlights 6th June 2025: Sensex jumps 747 points as RBI cuts repo rate by 50 bps; realty, bank, auto stocks surge - BusinessLine",M&M
2025-06-23,"Stock market today: Nifty50 ends below 25,000; BSE Sensex tanks over 500 points - The Times of India",M&M
2025-06-04,NR Vandana Textile shares list flat at Rs 45 on NSE SME - The Economic Times,M&M
2025-06-11,NSE gets Sebi nod to launch electricity derivatives - Mint,M&M
2025-06-02,"M&M gains as total sales rises 17% YoY to 84,110 units in May'25 - Business Standard",M&M
2025-07-25,Mahindra & Mahindra Limited's (NSE:M&M) CEO Compensation Is Looking A Bit Stretched At The Moment - simplywall.st,M&M
2025-07-23,"M&M Financial share drops 3% on mixed Q1 nos; should you buy, sell or hold? - Business Standard",M&M
2025-07-17,"Brokerages mixed on Tech Mahindra following Q1 show, shares fall; should you buy, sell, or hold shares? - Moneycontrol.com",M&M
2025-07-17,"Stock market today: Nifty50 ends above 25,200; BSE Sensex up over 60 points - The Times of India",M&M
2025-07-28,Kotak Mahindra Bank Stock Falls Over 6% After Q1FY26 Profit Miss - HDFC Sky,M&M
2025-08-01,Mahindra & Mahindra Ltd (MAHMF) Q1 2026 Earnings Call Highlights: Strong Profit Growth and ... - Yahoo Finance,M&M
2025-07-27,Kotak Mahindra Bank shares tumble 6%; here is why the Street is disappointed - Upstox,M&M
2025-07-18,"Share Market Highlights 18th July 2025: Sensex tanks 501 pts on selling in bank stocks, foreign fund outflows - BusinessLine",M&M
2025-07-30,Getting In Cheap On Mahindra Lifespace Developers Limited (NSE:MAHLIFE) Might Be Difficult - simplywall.st,M&M
2025-07-16,"Tech Mahindra Q1 profit up 34% at ₹1,140 crore, revenue rises 2.7% - Business Standard",M&M
2025-07-28,"Kotak Mahindra Bank shares sink 7% on muted Q1 show; should you buy, sell, or hold? - Moneycontrol.com",M&M
2025-07-07,"Kotak Mahindra Bank shares jump 4% after Q1 update, earnings date announcement; check details - Upstox",M&M
2025-07-28,"Sensex settles nearly 600 pts lower, Nifty below 24,700: FII selling, rising India VIX among key factors behind market fall - Moneycontrol.com",M&M
2025-07-28,Mahindra & Mahindra Financial Services First Quarter 2026 Earnings: EPS: ₹4.06 (vs ₹4.03 in 1Q 2025) - simplywall.st,M&M
2025-07-16,"Share Market Highlights 16 July 2025: Sensex, Nifty edge up amid weak global market trends, tariff-related uncertainty - BusinessLine",M&M
2025-07-17,"Angel One share price rises 2% on posting Q1 results; Buy, sell or hold? - Business Standard",M&M
2025-07-16,"Q1 results today: ITC Hotels, Tech Mahindra, L&T Tech among 19 on July 16 - Business Standard",M&M
2025-07-28,"Stocks to Watch Today: Kotak Bank, CDSL, Balkrishna Ind, Orient Cement, Tata Chemicals, Poonawalla Fincorp, VA Tech Wabag, RITES in focus on 28 July - Moneycontrol.com",M&M
2025-07-07,"Sensex, Nifty end flat as investors turned cautious amid India-US trade deal uncertainties - The New Indian Express",M&M
2025-07-20,"Q1 results this week: Infosys, Bajaj Finance, Nestle, Eternal, Paytm, Kotak Mahindra Bank among 95 compani - The Economic Times",M&M
2025-07-07,"Sensex, Nifty 50 end on a muted note— 10 key highlights from Indian stock market today - Mint",M&M
2025-07-28,"Q1 results today: Adani Green, Mazagon, BEL, Gail among 92 on July 28 - Business Standard",M&M
2025-07-04,SML Isuzu zooms 44% in 6 days; what's fuelling the automobile stock? - Business Standard,M&M
2025-07-09,"Crizac makes strong debut, lists at ₹281.05 on NSE, up 14.71% from IPO price - Mint",M&M
2025-07-17,Stocks to buy under ₹100: Experts recommend three shares to buy today — 17 July 2025 - Mint,M&M
2025-08-29,Mahindra & Mahindra Falls 3% on Profit Booking Pressure - HDFC Sky,M&M
2025-08-21,Mahindra EPC Irrigation Limited's (NSE:MAHEPC) Stock is Soaring But Financials Seem Inconsistent: Will The Uptrend Continue? - simplywall.st,M&M
2025-08-29,Kotak Mahindra Bank stock rating upgraded to Buy by UBS on market-linked business growth - Investing.com,M&M
2025-08-11,Here's why Mahindra Logistics' share is buzzing in trade today; details - Business Standard,M&M
2025-08-18,Kotak Mahindra share price rises as its unit secures UAE license to offer investment services - Upstox,M&M
2025-08-18,"GST buzz propels auto stocks: Mahindra overtakes Ford, Maruti nears GM in global m-cap race - Fortune India",M&M
2025-08-05,"Dixon Technologies Signs Master Services Deal with Tech Mahindra, Shares Trading Flat - Equitypandit",M&M
2025-08-04,"Stock Market Highlights 4th August 2025: Sensex rises 419 pts to close above 81k level on gains in metal, auto shares - BusinessLine",M&M
2025-08-01,"Stock market today: Nifty50 ends below 24,600; BSE Sensex down over 580 points as Donald Trump's 25% tari - The Times of India",M&M
2025-08-12,Markets In Choppy Waters; Sensex Drops 368 Points Dragged By Bank Stocks - ETV Bharat,M&M
2025-08-29,"Proposed GST rejig saved the day for Indian stock markets, says Chris Wood - Business Standard",M&M
2025-09-01,"Top gainers and losers on September 1: Bajaj Auto, Mahindra gain 4%, Sun Pharma falls nearly 2%; check full list - Upstox",M&M
2025-09-01,"Nifty Auto index up 3%; Bajaj, TaMo gain up to 5%; what's behind the rally? - Business Standard",M&M
2025-08-08,"Stock Market Highlights 8 August 2025: Markets tumble on tariff worries, foreign fund outflows; Sensex drops below 80,000 level - BusinessLine",M&M
2025-08-18,"Sensex jumps 1,168 pts, Nifty tops 25k: Here's why markets are rising today - Business Standard",M&M
2025-08-12,"Share Market Highlights 12 August 2025: Sensex ends at 80,235 after 833-point swing; Nifty at 24,487 - BusinessLine",M&M
2025-09-01,"Share Market Highlights 1st September 2025: Sensex jumps 555 pts on value buying across sectors, strong GDP data - BusinessLine",M&M
2025-08-22,"Stock Market Highlights 22 August 2025: Sensex, Nifty dive nearly 1% ending six-day rally as HDFC Bank, Reliance drag - BusinessLine",M&M
2025-08-20,Auto stocks rally 25–50% in FY26 so far: Is it time to shift gears? - The Economic Times,M&M
2025-08-19,"Stock market live: Maruti Suzuki, Eternal, Paytm among 56 stocks that hit 52-week high today - Upstox",M&M
2025-08-06,"Share Market Highlights 6th August 2025: Sensex falls by 160 points on sell-off in IT, healthcare shares as RBI keeps rate unchanged - BusinessLine",M&M
2025-08-11,"Kotak Mahindra MF, Citigroup, others buy 10.64% stake in Home First Finance for Rs 1,307 crore - The Economic Times",M&M
2025-08-19,Stock Market Highlights 19th August 2025: Stock markets rally for 4th day; Sensex climbs nearly 371 points on GST reform bid - BusinessLine,M&M
2025-08-21,2 smallcap auto stocks hit new highs; zoom up to 232% in CY25. Do you own? - Business Standard,M&M
2025-09-04,"M&M shares soar 7%, while other OEMs struggle to hold the gains; here is why - Upstox",M&M
2025-09-17,Here's why Mahindra Lifespace shares are up 7% in trade today; details - Business Standard,M&M
2025-09-04,GST Rate Cut for Auto Stocks Boosts Mahindra Shares Nearly 8 Percent - The Hindu,M&M
2025-09-26,"Tata Motors, Mahindra & Mahindra, and other auto stocks in focus as Trump’s slaps 25% tariff on heavy-duty - The Economic Times",M&M
2025-09-24,ETFs Investing in Mahindra & Mahindra Ltd. Stocks - TradingView,M&M
2025-09-16,"Indian benchmarks at two-month highs, led by autos; trade optimism, Fed hopes aid - Reuters",M&M
2025-09-08,"Tata Motors, M&M, other auto stocks rise up to 6% amid price cuts by some automakers, BofA upgrades - Moneycontrol.com",M&M
2025-09-10,"Kotak Bank shares gain on block deal worth ₹6,256 Crore - India Infoline",M&M
2025-09-08,Maruti vs M&M vs TaMo vs Hyundai; which auto stock is worth your portfolio? - Business Standard,M&M
2025-09-17,"Stocks in news: Apollo Tyres, Akzo Nobel, Dr Reddy's, Mahindra Lifespace, Coal India - The Economic Times",M&M
2025-09-04,"M&M, Escorts Kubota, Tata Motors shares rally up to 9% as investors cheer GST rate cuts - Moneycontrol.com",M&M
2025-09-30,"Stocks to Watch Today: Solarworld Energy, Jaro Education, Seshaasai Technologies, Bharat Electronics, Blue... - Moneycontrol.com",M&M
2025-09-10,"Rs 6,256-crore Kotak Bank block deal: BlackRock, BofA, Nomura among marquee buyers as SMBC exits - The Economic Times",M&M
2025-09-30,"Stocks to Watch today, Sept 30: IRFC, Tata Steel, M&M, JSW Steel, BEL - Business Standard",M&M
2025-09-02,"M&M, Tata Motors shares fall up to 2% amid buzz of GST hike on EVs priced from Rs 20-40 lakh - Moneycontrol.com",M&M
2025-09-10,"Stocks to Watch Today: Kotak Bank, Vikram Solar, Blue Jet Health, Sun Pharma, HEG, Sterling and Wilson,... - Moneycontrol.com",M&M
2025-09-04,Stock Market Highlights 4th September 2025: Markets end higher for second day as GST cuts cheer investors - BusinessLine,M&M
2025-09-02,"Stock Market News: Sensex Slips Over 200 Points, Nifty Above 25,500 As Headline Indices Finish Flat - Outlook Money",M&M
2025-09-26,"Sensex tanks 733 points, Nifty 50 below 24,700: Why did Indian stock market fall today? Explained with 5 reasons - Mint",M&M
2025-09-10,"SMBC offloads 1.62% stake in Kotak Mahindra Bank for Rs 6,256 crore - Moneycontrol.com",M&M
2025-09-08,"Stocks to watch today, Sep 8: SpiceJet, TaMo, M&M, Vedanta, BHEL, HFCL - Business Standard",M&M
2025-09-15,"NSE/BSE, Top Gainers & Top Losers Today 15 September 2025: Bajaj Finance, Eternal, UltraTech Cement, Reliance, SBI - BusinessLine",M&M
2025-09-23,"Closing Bell: Sensex Closes 50 pts Lower, Nifty 50 Settles Below 25,170; SBI Life, HUL, Trent Top Loser - Goodreturns",M&M
2025-09-09,"Strong market debut! Amanta Healthcare share price lists at ₹135 on NSE, a premium of 7% over IPO price - Mint",M&M
2025-10-19,Mahindra & Mahindra Executes Significant Block Trade on NSE - scanx.trade,M&M
2025-10-10,"Trade Spotlight: How should you trade Mahindra Finance, IDFC First Bank, Tata Steel, BSE, Fortis... - Moneycontrol.com",M&M
2025-10-14,Tech Mahindra shares trade in the red after Q2 results; here is how the IT major fared and expert views - Upstox,M&M
2025-10-15,"Stocks to watch today, Oct 15: Axis Bank, TechM, L&T Finance, Mishra Dhatu - Business Standard",M&M
2025-10-22,"Stock Market Holiday: Are NSE, BSE open or closed today for Diwali Balipratipada? - The Economic Times",M&M
2025-10-22,"Stock Market Holiday Today: Are BSE, NSE Open Or Closed On October 22? - NDTV Profit",M&M
2025-10-06,Kotak Bank Shares Up 2.15% as Advances Rise 15.8% in Q2 - HDFC Sky,M&M
2025-10-28,"Sensex, Nifty Slip Amid Profit-Taking, Weak Asian Markets - ETV Bharat",M&M
2025-10-06,"Top gainers and losers, October 3: Max Healthcare soars 6%, TCS, Tech Mahindra rise 3%; check list - Upstox",M&M
2025-10-13,"Stocks to Watch Today: Tata Capital, DMart, Waaree Renewable, Phoenix Mills, Mahindra Lifespace, HCC,... - Moneycontrol.com",M&M
2025-10-28,"Adani Green, TVS Motor, M&MFIN to Report Q2FY26 Today - HDFC Sky",M&M
2025-10-17,"Mahindra EPC Irrigation Reports Q2 FY2026 Results, Board Approves Unaudited Financials - scanx.trade",M&M
2025-10-20,"Dividends: Tech Mahindra, 6 others in focus; are they in your portfolio? - Business Standard",M&M
2025-10-24,"Stocks to Watch Today: Kotak Mahindra Bank, Colgate Palmolive, Sagar Cements, Premier Energies, Syrma SGS,... - Moneycontrol.com",M&M
2025-10-31,Kotak Mahindra Bank Deputy Managing Director Shanti Ekambaram Retires - scanx.trade,M&M
2025-11-01,Mahindra Lifespace Q2FY26 results: Total income rises to ₹33 crore - Business Standard,M&M
2025-10-29,"Blue Dart, Adani Green, M&M Fin rise up to 12% on strong Q2 results, positive brokerage outlook - Moneycontrol.com",M&M
2025-10-27,"Stocks to Watch Today: Coforge, NCC, Kotak Bank, GPT Infra, Vikran Engineering, Eclerx, Container... - Moneycontrol.com",M&M
2025-10-14,"Tech Mahindra Q2 results: Net profit falls 4.5% to Rs 1,195 crore; IT firm declares Rs 15 interim dividend - Moneycontrol.com",M&M
2025-10-27,Kotak Mahindra Bank shares fall 2% today after mixed Q2 results; brokerages upbeat -- should you buy or... - Moneycontrol.com,M&M
2025-10-28,"NSE/BSE, Top Gainers & Top Losers Today 28 Oct 2025: Tata Steel, L&T, SBI, Kotak Bank, Bharti Airtel - BusinessLine",M&M
2025-10-14,"Q2 results today: Tech Mahindra, Bank of Maharashtra, 20 others on Oct 14 - Business Standard",M&M
2025-10-07,TCS vs Infosys vs HCL Tech: Here's the best IT stock for your portfolio - Business Standard,M&M
2025-10-25,"Q2 results today: Kotak Mahindra, Zen Technologies among 9 firms on Oct 25 - Business Standard",M&M
2025-10-25,"Kotak Mahindra Bank Reports Lower Fresh Slippages and Q2 FY26 Consolidated Net Profit of ₹4,468 Crore - scanx.trade",M&M
2025-11-11,Mahindra & Mahindra Financial Services Limited (NSE:M&MFIN) Looks Inexpensive But Perhaps Not Attractive Enough - simplywall.st,M&M
2025-11-05,"Mahindra & Mahindra shares may rally up to 22%, brokerages say after Q2 results. Should you buy, sell or h - The Economic Times",M&M
2025-11-21,M&M stock becomes top Nifty gainer as brokerages bullish on 'ambitious' growth targets - Moneycontrol.com,M&M
2025-11-24,Kotak Mahindra Bank Stock Split 1:5 Approved on 40th Foundation Day - HDFC Sky,M&M
2025-11-04,"SML Isuzu Rebrands as SML Mahindra Limited, Updates Trading Symbol - scanx.trade",M&M
2025-11-21,Kotak Mahindra Bank board to consider stock split proposal today - India Infoline,M&M
2025-11-16,"Kotak Mahindra Bank shares jump 2%, up 18% in 2025: All you need to know about upcoming stock split - Upstox",M&M
2025-11-03,M&M Q2 preview: Here's what to expect from SUV maker in September quarter - Business Standard,M&M
2025-11-11,"NSE/BSE, Top Gainers & Top Losers Today 11 Nov 2025: BEL, M&M, Adani Ports, HCLTech, Eternal - BusinessLine",M&M
2025-11-09,Returns On Capital At Tech Mahindra (NSE:TECHM) Have Stalled - simplywall.st,M&M
2025-11-28,"M&M shares rise 2% as Nomura finds new e-SUV priced attractively, sees up to 16% upside - Moneycontrol.com",M&M
2025-11-14,Kotak Mahindra Bank to consider stock split on November 21: What investors should know - Upstox,M&M
2025-11-28,M&M shares rise 2% as Nomura gives thumbs up to new 7-seater launch. Check target price - The Economic Times,M&M
2025-11-24,"Nifty IT index rises 1.6% today as US Fed cut bets strengthen; Tech Mahindra, Infosys stocks lead gains - Moneycontrol.com",M&M
2025-11-04,"Mahindra & Mahindra Q2 Result: Net profit rises 16% YoY to ₹3,673 crore, revenue up 21.75% - Upstox",M&M
2025-11-24,"Infosys, Tech Mahindra, HCL Tech, TCS shares rise up to 3%. Here’s why - The Economic Times",M&M
2025-11-12,"IT shares gain for 3rd day: Tech Mahindra, TCS rise up to 3% on hopes of Fed rate cut, end to US shutdown - Moneycontrol.com",M&M
2025-11-19,"Mahindra Holidays shares zoom 7% on plans to expand into leisure hospitality business with ₹1,000 crore investment - Upstox",M&M
2025-11-06,RBL Bank shares jump 2.5% today as Mahindra & Mahindra sells stake with 64% gain via block deal - Moneycontrol.com,M&M
2025-11-03,"Stocks to Watch Today: Tata Motors, Bank of Baroda, SBFC Finance, Mahindra Holidays, Eicher, Titagarh... - Moneycontrol.com",M&M
2025-11-17,Kotak Bank Board Meeting Nov 21: Stock Split Proposal - HDFC Sky,M&M
2025-11-21,"Kotak Bank Stock Split, Groww Results, India Shelter Fundraise Today - HDFC Sky",M&M
2025-11-21,Kotak Mahindra Bank to announce stock split today: What investors need to know - The Economic Times,M&M
2025-11-08,Mahindra & Mahindra Reports Strong October Sales Growth and Quarterly Performance - scanx.trade,M&M
2025-11-21,Kotak Mahindra Bank approves 1:5 stock split. Check details - The Economic Times,M&M
2025-12-12,SML Mahindra Limited's (NSE:SMLMAH) 29% Price Boost Is Out Of Tune With Earnings - simplywall.st,M&M
2025-12-15,"Mahindra & Mahindra shares down by 1.90 % due to Mexico tariffs; Nifty, Sensex end the day in red - HDFC Sky",M&M
2025-12-15,"M&M, Eicher Motors, Bajaj Auto shares fall up to 2% amid Mexico's tariffs, profit booking - Moneycontrol.com",M&M
2025-12-04,NIFTY In November 2025 Gives Positive of 1.87% - India Infoline,M&M
2025-12-31,Choice recommends these 3 stocks to have in your portfolio in 2026 - Business Standard,M&M
2025-12-10,Mahindra & Mahindra ESG Rating Corrected to 74 in Latest Assessment - scanx.trade,M&M
2025-12-11,"Stock Markets Snap 3-Day Slide; Sensex Jumps 427 Pts On Buying In Metal, Auto Shares - ETV Bharat",M&M
2025-12-12,"Stock market today: Nifty 50 trade setup, USD vs INR to IPO watch list — Seven stocks to buy or sell on Friday - Mint",M&M
2025-12-12,"Rupee hits new record low: TCS, Coforge, Tech Mahindra; here's how IT stocks are faring on Friday - Upstox",M&M
2025-12-30,Kotak Mahindra Bank fixes January 14 as record date for upcoming stock split - The Economic Times,M&M
2026-01-01,"Trade Spotlight: How should you trade BPCL, Aditya Birla Capital, Eicher Motors, Mahindra and Mahindra,... - Moneycontrol.com",M&M
2025-12-09,M&M production climbs 18% YoY in November'25 - Business Standard,M&M
2025-12-30,Kotak Mahindra Bank fixes record date for 1:5 stock split. Details here - Mint,M&M
2025-12-10,"Tech Mahindra Allocates 60,706 Equity Shares Under Employee Stock Option Plans - scanx.trade",M&M
2025-12-18,"Trade Spotlight: How should you trade Granules India, SRF, IDFC First Bank, Pricol, Mahindra Finance, and... - Moneycontrol.com",M&M
2026-01-01,Mahindra & Mahindra Ltd spurts 1.18% - Business Standard,M&M
2026-01-01,"Auto stocks rise up to 3%, Maruti Suzuki reports 22% rise in December sales - Moneycontrol.com",M&M
2025-12-11,"Bank shares snap 3-day decline; Kotak Mahindra, HDFC Bank lead gains - here are key levels to watch - Moneycontrol.com",M&M
2025-12-08,Mahindra & Mahindra Reports November 2025 Production and Sales Figures - scanx.trade,M&M
2025-12-27,"Kotak Mahindra Bank Sets January 14, 2026 Record Date for 1:5 Share Split - scanx.trade",M&M
2025-12-14,"SENSEX slips 41 pts, NIFTY50 flat in noon session; Vi, PVR INOX, Ola Electric among buzzing stocks - Upstox",M&M
2025-12-01,"Stock Market Highlights 1st December 2025: Markets slip after record highs; Sensex, Nifty end lower - BusinessLine",M&M
2025-12-15,"Share Market Highlights 15 December 2025: Sensex settles at 85,213.36; Nifty skids 19.65 points to 26,027.30 - BusinessLine",M&M
2025-12-15,Stock Markets End Marginally Lower On Foreign Fund Outflows - ETV Bharat,M&M
2025-12-27,Kotak Mahindra Bank Raises Authorized Share Capital to ₹1900 Crore with RBI Approval - scanx.trade,M&M
2020-01-15,"Share Market Update: Sensex ends 79 points lower, Nifty at 12,343; IndusInd Bank, Wipro, BPCL top losers - Business Today",BHARTIARTL
2020-01-20,"Market Wrap, Jan 20: Sensex declines over 400 pts, Nifty slips below 12,300 - Business Standard",BHARTIARTL
2020-01-17,Mobile Operator Airtel Plans To Raise $37.5M Through Malawi IPO - Moguldom,BHARTIARTL
2020-01-10,SC stays NCLAT order reinstating Cyrus Mistry as chairman of Tata Sons - The Economic Times,BHARTIARTL
2020-01-23,"Sensex rises 271 points on value buying, L&T up 3 per cent - India TV News",BHARTIARTL
2020-01-23,"Share Market Update: Sensex ends 271 points higher, Nifty at 12,179; YES Bank, Indian Oil, L&T top gainers - Business Today",BHARTIARTL
2020-01-24,"Sensex drops over 70 points in early trade, Nifty below 12,200; Rupee falls 5 paise against US dollar - The Indian Express",BHARTIARTL
2020-01-30,"Share Market Update: Sensex ends 284 points lower, Nifty at 12,035; YES Bank, RIL, Bajaj Finserv top losers - Business Today",BHARTIARTL
2020-02-18,"Indus Finance Nine Monthly Results, Nine Monthly Earnings for Indus Finance - The Economic Times",BHARTIARTL
2020-02-07,Predatory Pricing — Not only abuse but also proof of dominance - SCC Online,BHARTIARTL
2020-02-22,Bharti Infratel gets DoT nod for merger with Indus Towers - Business Today,BHARTIARTL
2020-02-05,Apollo Tyres’ investors ignore tepid Q3 as worst may be over - Mint,BHARTIARTL
2020-02-18,AGR dues: Vodafone Idea stock falls over 11 percent - India TV News,BHARTIARTL
2020-03-17,"Bharti Airtel, Vodafone Idea shares gain as DoT seeks 20-year window for AGR payment - The Economic Times",BHARTIARTL
2020-03-14,"Cadsys (India) Ltd. Cash Flow, Financial Statements - The Economic Times",BHARTIARTL
2020-03-09,Hilton Metal Profit and Loss Reports - The Economic Times,BHARTIARTL
2020-03-13,"Affordable Robotic Yearly Results, Financial summary, Affordable Robotic Yearly Earnings - The Economic Times",BHARTIARTL
2020-03-09,"Williamson Magor Target Share Price, Williamson Magor Share Price Forecast - The Economic Times",BHARTIARTL
2020-04-23,"Integrated Hitech Ltd. Yearly results, Financial Summary - The Economic Times",BHARTIARTL
2020-04-03,NSE identifies five companies for surveillance action - Mint,BHARTIARTL
2020-04-22,"Stock Market Today: Sensex, Nifty rise on Donald Trump's pro-active approach on oil price crash; Energy, auto stocks gain - Zee Business",BHARTIARTL
2020-05-19,"Bharti Airtel shares jump 8.7 pc despite Q4 loss of Rs 5,237 crore - ANI News",BHARTIARTL
2020-05-26,"Bharti to sell 2.75% stake in Airtel for $1bn, reduce debt - The Times of India",BHARTIARTL
2020-05-19,"Bharti Airtel rallies 10 pc after Q4 earnings, hits 1-year high - DT Next",BHARTIARTL
2020-05-07,"Sensex falls 242 points, Nifty ends a tad below 9,200; financials, FMCG, banks top laggards - The Indian Express",BHARTIARTL
2020-05-25,"Asian Hotels Target Share Price, Asian Hotels Share Price Forecast - The Economic Times",BHARTIARTL
2020-05-18,"Share Market Update: Sensex ends 1,068 points lower, Nifty at 8,823; IndusInd Bank, Zee Ent top losers - Business Today",BHARTIARTL
2020-05-06,"Stock Market Today: Sensex, Nifty continue to trade weak; Oil, gas, energy stocks dip - Zee Business",BHARTIARTL
2020-06-18,"NIFTY 50 Index - Overview, How to Calculate the Index - Corporate Finance Institute",BHARTIARTL
2020-06-04,Amazon in talks to buy 5% stake worth $2 billion in Bharti Airtel: Report - Business Standard,BHARTIARTL
2020-06-15,Day traders ruling the markets - The Hans India,BHARTIARTL
2020-06-10,Standard Chartered Bank Plc to delist IDRs on June 15 - BusinessLine,BHARTIARTL
2020-06-05,"Stocks in focus: RIL, SBI, Larsen & Toubro, Bharti Airtel, RITES, Power Grid to remain in news - financialexpress.com",BHARTIARTL
2020-07-30,Bharti Airtel shares drop over 3 per cent after company posts Q1 results - The Statesman,BHARTIARTL
2020-07-28,"NSE introduces trading of T-bills, SDLs in capital market segment - Business Standard",BHARTIARTL
2020-07-12,"Sri Lakshmi Saraswathi Textiles Yearly results, Financial Summary - The Economic Times",BHARTIARTL
2020-07-11,"Motor Gen Fin Target Share Price, Motor Gen Fin Share Price Forecast - The Economic Times",BHARTIARTL
2020-07-10,"SBI Card Yearly Results, Financial summary, SBI Card Yearly Earnings - The Economic Times",BHARTIARTL
2020-09-01,"Stocks in the news | Bharti Airtel, L&T, Biocon, M&M, Aarey Drugs, Jindal Steel & Power, India... - Moneycontrol.com",BHARTIARTL
2020-08-14,Airtel partners Standard Chartered to boost financial inclusion in Africa - Financial Nigeria,BHARTIARTL
2020-08-17,SGX Nifty up 110 points; here's what changed for market while you were sleeping - The Economic Times,BHARTIARTL
2020-09-30,"Decipher Labs Yearly results, Financial Summary - The Economic Times",BHARTIARTL
2020-09-18,CAMS IPO opens on Monday: 10 things to know - Mint,BHARTIARTL
2020-09-11,PE firm ADV Partners sells 10.46% stake in Amber Enterprises for ₹604 crore - Mint,BHARTIARTL
2020-10-31,"Prismx Global Ventures Cash Flow, Financial Statements - The Economic Times",BHARTIARTL
2020-10-10,"ITI Stock/Share price , NSE/BSE Forecast News and Live Quotes - Equitymaster",BHARTIARTL
2020-10-09,"Share Market Highlights: Sensex ends 326 points higher, Nifty at 11,914 as RBI keeps repo rate unchanged at 4% - Business Today",BHARTIARTL
2020-11-18,69 Stocks on NSE Hit 52-Weeks Highs - Equitypandit,BHARTIARTL
2020-11-09,"Sensex and Nifty settle at record highs on positive global cues; banks, IT stocks rally - The Indian Express",BHARTIARTL
2020-11-02,Stock market update: 11 stocks hit 52-week lows on NSE - The Economic Times,BHARTIARTL
2020-11-11,"Agri-Tech (India) Yearly results, Financial Summary - The Economic Times",BHARTIARTL
