Date,headline,Ticker
2020-05-06,"Stock Market Today: Sensex, Nifty continue to trade weak; Oil, gas, energy stocks dip - Zee Business",HDFCBANK
2020-05-31,PCR at 1.15 indicates neutral market - The Hans India,HDFCBANK
2020-05-11,Cure.Fit to launch paid version of popular online fitness classes - Business Today,HDFCBANK
2020-05-11,"Fixed Deposit, Gold or Equity? How to invest for best returns in times like COVID-19 - financialexpress.com",HDFCBANK
2020-06-25,Annual pay in FY20: HDFC Bank MD Aditya Puri’s Rs 18.9 crore vs SBI Chairman Rajnish Kumar’s Rs 31... - Moneycontrol.com,HDFCBANK
2020-06-05,View: NSE lies the head that bears the bourse - The Economic Times,HDFCBANK
2020-06-22,"Sensex, Nifty End At Over Three-Month Highs Led By Metal, Banking Shares - NDTV Profit",HDFCBANK
2020-06-15,HDFC Bank boss Aditya Puri's record as India's longest-serving bank CEO likely to be unbroken - Moneycontrol.com,HDFCBANK
2020-06-21,PNB plans to hit capital market in Q4 - The Economic Times,HDFCBANK
2020-06-19,"HDFC looking to raise up to Rs 14,000 crore to bolster liquidity and expand business - Moneycontrol.com",HDFCBANK
2020-06-19,Trending stocks: Brigade Enterprises shares gain over 2% - The Economic Times,HDFCBANK
2020-06-07,HDFC Bank nets 2.5 lakh new customers through instant account opening in lockdown - Moneycontrol.com,HDFCBANK
2020-06-07,PI Industries’ sanguine growth outlook for FY21 impresses investors - Mint,HDFCBANK
2020-06-08,"Share Market Update: Sensex ends 83 points higher, Nifty at 10,167; Axis Bank, IndusInd Bank, BPCL, IOC top performers - Business Today",HDFCBANK
2020-06-29,"Share Market Highlights: Sensex ends 209 points lower, Nifty at 10,312; Axis Bank, Coal India, Hindalco top laggards - Business Today",HDFCBANK
2020-07-27,Aditya Puri sells HDFC Bank shares worth Rs 843 crore - The Times of India,HDFCBANK
2020-07-27,"Aditya Puri sells HDFC Bank shares worth ₹842 cr, holding down to 0.01% - The Hindu",HDFCBANK
2020-07-10,China’s PBoC sells HDFC stake - Mint,HDFCBANK
2020-07-06,HDFC Bank Gains Over 3% On Q1 Business Update - Goodreturns,HDFCBANK
2020-07-29,"IndusInd Bank to raise Rs 3,300 crore via share sale - The Economic Times",HDFCBANK
2020-07-30,Trending stocks: ICICI Bank shares gain nearly 1% - The Economic Times,HDFCBANK
2020-07-13,Jhunjhunwala gives away his multibagger hunt formula - The Economic Times,HDFCBANK
2020-07-10,"SBI Card Yearly Results, Financial summary, SBI Card Yearly Earnings - The Economic Times",HDFCBANK
2020-07-03,"RIL gains as Jio receives 12th cheque worth Rs 1,895 crore - The Economic Times",HDFCBANK
2020-07-12,Trade setup: Nifty looks all set to see a bearish Failure Swing now - The Economic Times,HDFCBANK
2020-07-11,"Motor Gen Fin Target Share Price, Motor Gen Fin Share Price Forecast - The Economic Times",HDFCBANK
2020-07-12,"Sri Lakshmi Saraswathi Textiles Yearly results, Financial Summary - The Economic Times",HDFCBANK
2020-07-27,HDFC Bank declines over 3 per cent as Aditya Puri sells shares - India TV News,HDFCBANK
2020-07-17,"Sensex rallies 548 points; Reliance, HDFC Bank spurt nearly 4 per cent - India TV News",HDFCBANK
2020-07-21,HDFC Bank fires 6 employees over 'improper lending' related to car loans - Business Today,HDFCBANK
2020-08-16,"HDFC Bank Outlook for the Week (Aug 17,2020 – Aug 21,2020) - Equitypandit",HDFCBANK
2020-08-16,There’s no clarity on split shares’ taxation - Mint,HDFCBANK
2020-08-19,NSE Clearing Revises Bank Guarantee Limit for Trading and Clearing Members - Moneylife,HDFCBANK
2020-08-03,Look who lapped up Bandhan Bank shares in Monday's deals - The Economic Times,HDFCBANK
2020-08-18,"Experts pick 20 stocks which may benefit from PM Modi's push for optical fibre, infra, cyber security - Moneycontrol.com",HDFCBANK
2020-08-10,"Burman family open to hike Eveready stake, no takeover plans: Mohit Burman - The Economic Times",HDFCBANK
2020-08-28,"250 stocks under Rs 25 surge up to 1,600% in 5 months! Vijay Kedia says this market has got high BP - The Economic Times",HDFCBANK
2020-08-21,Indian refiners’ gold bars to be accepted for delivery on NSE platform - The Economic Times,HDFCBANK
2020-08-11,Stock market update: Commodities stocks up; JSW climbs 4% - The Economic Times,HDFCBANK
2020-08-19,Stock market update: Nifty Commodities index up; Aarti Ind gains over 5% - The Economic Times,HDFCBANK
2020-08-18,Sebi imposes Rs 5 lakh fine on individual in Taurus MF matter - The Economic Times,HDFCBANK
2020-08-11,Can buying shares in a rights issue leave you in a tax mess? - The Economic Times,HDFCBANK
2020-08-11,"S&P 500 ends up slightly, tech-related shares underperform value - The Economic Times",HDFCBANK
2020-08-17,SGX Nifty up 110 points; here's what changed for market while you were sleeping - The Economic Times,HDFCBANK
2020-10-01,CAMS Shares Debuted at Premium of 23% Over Issue Price - Equitypandit,HDFCBANK
2020-09-19,CAMS IPO: Information Analysis - Value Research,HDFCBANK
2020-09-16,"CAMS fixes IPO price band at Rs 1,229-1,230/share; issue to open on Sep 21 - The Indian Express",HDFCBANK
2020-09-28,NSE launches new version of RFQ platform for debt securities - The Economic Times,HDFCBANK
2020-09-16,"CAMS IPO: Price band set at Rs 1,229-1,230/share - Moneycontrol.com",HDFCBANK
2020-09-07,Stock market news: Tata Motors shares surge 9% - The Economic Times,HDFCBANK
2020-09-22,Advent Stock Broking fined for violating norms in use of NSE co-location facility - The Economic Times,HDFCBANK
2020-09-30,"54 stocks that made crorepatis on Rs 1 lakh investment, and how! - The Economic Times",HDFCBANK
2020-09-18,CAMS IPO opens on Monday: 10 things to know - Mint,HDFCBANK
2020-09-18,"Britannia Industries settles case with Sebi, pays over Rs 46 lakh - The Economic Times",HDFCBANK
2020-10-01,CAMS makes stock markets debut at 23% premium over issue price - Mint,HDFCBANK
2020-09-04,"FOMO is gone, its cousin FOBI haunts investors now: How to deal with them - The Economic Times",HDFCBANK
2020-09-11,"RBI issues new rules for appointment, functioning of bank CCO - The Economic Times",HDFCBANK
2020-09-11,PE firm ADV Partners sells 10.46% stake in Amber Enterprises for ₹604 crore - Mint,HDFCBANK
2020-09-08,IDBI Bank sells remaining 0.21% stake in NSE - The Economic Times,HDFCBANK
2020-09-04,BNP Paribas bets on ‘BHARATH’ as successful businesses of tomorrow - The Economic Times,HDFCBANK
2020-09-30,"Decipher Labs Yearly results, Financial Summary - The Economic Times",HDFCBANK
2020-09-19,'Nasdaq whale' closes more large options trades - The Economic Times,HDFCBANK
2020-09-11,"HDFC Bank, ICICI Bank, Axis Bank shares may rally up to 42%; Morgan Stanley sees banking recovery - financialexpress.com",HDFCBANK
2020-10-21,Aditya Puri says Deepak Parekh gave him a free hand to build HDFC Bank - Moneycontrol.com,HDFCBANK
2020-11-01,EQUITASBNK Share Price Today - Equitas Small Finance Bank on NSE/BSE - scanx.trade,HDFCBANK
2020-10-09,"Share Market Highlights: Sensex ends 326 points higher, Nifty at 11,914 as RBI keeps repo rate unchanged at 4% - Business Today",HDFCBANK
2020-10-31,"Natural Biocon (I) Balance Sheets, Financial Statements - The Economic Times",HDFCBANK
2020-10-02,5 Best Index Mutual Funds to invest in 2020 to beat corona virus situation - Myinvestmentideas,HDFCBANK
2020-10-29,"Illegal CIS case: Sebi slaps Rs 1.5-cr fine on Samruddha Jeevan Foods, others - The Economic Times",HDFCBANK
2020-10-30,Axis Bank price targets get a raise post Q2 - The Economic Times,HDFCBANK
2020-10-11,"Rakesh Jhunjhunwala reveals his pearls of wisdom, asks Robinhoods to stop trading​​ - The Economic Times",HDFCBANK
2020-10-23,Stock market update: BSE Consumer Durables index up 2%; Orient Electric leaps 7% - The Economic Times,HDFCBANK
2020-10-16,"Home loan festive offer: Check out the latest offers from SBI, HDFC and other banks - financialexpress.com",HDFCBANK
2020-11-23,'RBI seeks details from HDFC Bank following outage at data centre' - The Times of India,HDFCBANK
2020-11-25,Trading in Lakshmi Vilas Bank shares to be suspended from Thursday: NSE - The Economic Times,HDFCBANK
2020-11-26,"NPCI gets new shareholders, allots 4.6% shares worth Rs 81.6 crore - Moneycontrol.com",HDFCBANK
2020-12-01,"Sensex surges 506 points to new closing high; Nifty tops 13,100 - The New Indian Express",HDFCBANK
2020-11-08,"Share market: US election results, corporate earnings to guide Dalal Street in Diwali week - Business Today",HDFCBANK
2020-11-02,Equitas Small Finance Bank shares close nearly 1% lower in debut trade - The Economic Times,HDFCBANK
2020-11-06,"ICICI Pru Life raises Rs 1,200 cr in maiden NCD sale - The Economic Times",HDFCBANK
2020-11-11,"Agri-Tech (India) Yearly results, Financial Summary - The Economic Times",HDFCBANK
2020-11-27,Stock market update: BSE MidCap index climbs 2%; Indraprastha Gas surges 11% - The Economic Times,HDFCBANK
2020-11-09,Morepen Labs Q2 results: Net profit jumps over 6-fold to Rs 27cr - The Economic Times,HDFCBANK
2020-11-20,"Gland Pharma shares make a strong debut, jump nearly 23% - Mint",HDFCBANK
2020-12-03,HDFC Bank shares fall 1% after RBI orders it to temporarily stop launch of new digital initiatives - The Indian Express,HDFCBANK
2020-12-07,"In 2020, Highest Broker Defaults in 20 years: NSE Expels 18 Brokers, 2 Firms Wind up Voluntarily - Moneylife",HDFCBANK
2020-12-17,BPCL board approves buying out Oman Oil's stake in Bina refinery - The Economic Times,HDFCBANK
2020-12-16,HDFC Securities' top 10 stocks picks for 2021 - Mint,HDFCBANK
2020-12-14,"Indices end at fresh closing highs, Sensex rises 154 points; PSU banks, metals shine - The Indian Express",HDFCBANK
2020-12-22,"Precot Meridian Balance Sheets, Financial Statements - The Economic Times",HDFCBANK
2020-12-03,HDFC Bank shares fall over 2% after RBI asks firm to halt launch of new digital initiatives - India TV News,HDFCBANK
2020-12-30,Antony Waste Handling Cell IPO share allotment finalised. How to check - Mint,HDFCBANK
2020-12-16,Nifty Financial Services Index – NSE to Launch Derivative Contract! - Trade Brains,HDFCBANK
2021-02-01,"Indian shares extend sharp post-budget gains, HDFC Bank leads - Reuters",HDFCBANK
2021-01-22,SEBI imposes Rs 1 cr penalty on HDFC Bank for wrongly invoking pledge of securities - The News Minute,HDFCBANK
2021-01-23,HDFC Bank penalised for violations - The New Indian Express,HDFCBANK
2021-01-27,"Sensex falls 938 points, Nifty settles below 14,000 weighed by HDFC twins and RIL - The Indian Express",HDFCBANK
2021-01-11,"Nifty may face a hurdle at 14,500; Bank Nifty to rise - The Economic Times",HDFCBANK
2021-01-12,NSE-BSE bulk deals: LTS Investment buys stake in Bliss GVS and other deals - The Economic Times,HDFCBANK
2021-01-09,5 pharma stocks that more than doubled money in one year - The Economic Times,HDFCBANK
2021-01-21,"Sensex hits 50,000-mark for first time ever: Top reasons behind the surge - The Times of India",HDFCBANK
2021-01-21,NSE acquires market data terminal firm Cogencis - The Economic Times,HDFCBANK
2021-01-16,Sensex swings nearly 900 points on global cues - The Times of India,HDFCBANK
2021-01-13,Govt to sell up to 10% equity in SAIL through offer for sale - The Economic Times,HDFCBANK
2021-01-28,"Sensex Slumps Over 800 Points, Nifty Below 13,750; PSU Banks Worst Hit - NDTV Profit",HDFCBANK
2021-02-01,"Can’t expect relief for stock market this year, hope there's no further taxation: Saurabh Mukherjea - The Economic Times",HDFCBANK
2021-01-01,"RPL case: Sebi fines Reliance Industries, Mukesh Ambani, two other entities - The Times of India",HDFCBANK
2021-01-22,"Stove Kraft Nine Monthly Results, Nine Monthly Earnings for Stove Kraft - The Economic Times",HDFCBANK
2021-01-12,"Sensex slips over 100 points in early trade; Nifty tests 14,450 - The New Indian Express",HDFCBANK
2021-01-05,YES Bank stages a comeback as large-cap - BusinessLine,HDFCBANK
2021-01-12,"Sebi imposes Rs 85 lakh fine on Orient Resorts, 2 individuals for non-compliance with its directive - The Economic Times",HDFCBANK
2021-01-21,"Stocks in focus: Bajaj Finance, HDFC AMC, Havells India and more - The Economic Times",HDFCBANK
2021-02-17,"Supreme Holdings Yearly Results, Financial summary, Supreme Holdings Yearly Earnings - The Economic Times",HDFCBANK
2021-02-18,"Share Market Highlights: Sensex ends 379 points lower, Nifty at 15,118; Maruti, TCS, Axis Bank top losers - Business Today",HDFCBANK
2021-02-15,"Sensex rises 610 points settle above 52,000-mark, Nifty ends at 15,315; banks and financials rally - The Indian Express",HDFCBANK
2021-02-04,"Bank Nifty hits record 35,000, up over 13% since Budget Day; BoB, PNB, Kotak Bank lead - Moneycontrol.com",HDFCBANK
2021-02-24,"Sensex zooms 1,030 points in extended trading session; Nifty settles at 14,982 - The Times of India",HDFCBANK
2021-02-09,India Inc's billion-dollar club grows to 302 - Business Today,HDFCBANK
2021-02-26,"Mayhem in Dalal Street: Sensex crashes 1,939 points, Nifty ends below 14,550 amid global selloff - The Indian Express",HDFCBANK
2021-02-24,"Market Wrap, Feb 24: Here's all that happened in the markets today - Business Standard",HDFCBANK
2021-02-21,Bitcoin will remain useful but may not replace gold - The Economic Times,HDFCBANK
2021-02-16,"Bitcoin jumps to $50,000 as record-breaking rally accelerates - The Economic Times",HDFCBANK
2021-02-19,Dollar nursing losses after jobs data mars recovery narrative; sterling buoyant - The Economic Times,HDFCBANK
2021-02-23,"Top gainers today: 8 shares rise up to 7%; ONGC, Tata Steel, Hindalco, UltraTech Cement, SBI, Sun Pharma - Business Today",HDFCBANK
2021-03-25,HDFC Bank Limited Financial Statements – NSE:HDFCBANK - TradingView,HDFCBANK
2021-03-26,Bank Nifty vs Nifty Fin Services: Where to invest your money? - The Economic Times,HDFCBANK
2021-03-04,Sensex slips nearly 600 points amid weak global cues - The Indian Express,HDFCBANK
2021-04-01,NSE reduces F&O lot size of Nifty50 contracts to 50 from 75; halves market lot size for 40 other... - Moneycontrol.com,HDFCBANK
2021-03-03,"Easy Trip Planners Balance Sheets, Financial Statements - The Economic Times",HDFCBANK
2021-03-10,"Stock Market highlights: Sensex ends 254 pts higher; Bajaj Finance, Sun Pharma, Tech Mahindra top gainers - Business Today",HDFCBANK
2021-03-22,Start ops from disaster recovery site within 45 minutes of tech glitch: Sebi tells MIIs - The Economic Times,HDFCBANK
2021-03-26,KKR-led consortium invests $234 million in Five-Star Business Finance - The Economic Times,HDFCBANK
2021-03-08,Copper futures fall over 1% on weak demand - The Economic Times,HDFCBANK
2021-03-24,Bitcoin can prosper without becoming a major currency: SkyBridge's Scaramucci - The Economic Times,HDFCBANK
2021-03-09,"Stock Market Highlights: Sensex gains 581 pts to end above 51k, Nifty at 15,098; bank, IT stocks lead rally - Business Today",HDFCBANK
2021-04-22,"Happy 25th Birthday, Nifty50! So what has changed & what hasn’t - The Economic Times",HDFCBANK
2021-04-27,"Markets shrug off concerns over surging Covid cases, rise 1% - The Indian Express",HDFCBANK
2021-04-23,"Nifty turns 25: Here's how the index progressed from 1,000 to 14,000 - Business Standard",HDFCBANK
2021-04-12,"Prabhat Dairy to be delisted from BSE, NSE on Apr 30 - The Times of India",HDFCBANK
2021-04-12,"Share Market Today: BSE Sensex Crashes Over 1400 Points, NSE Nifty Plunges 431 Points - India.Com",HDFCBANK
2021-04-26,Isaac Newton made this blunder 300 years back & lost millions; Robinhood traders repeating it - The Economic Times,HDFCBANK
2021-04-08,"Sensex surges over 300 points in early trade; Nifty tops 14,900-mark - The Indian Express",HDFCBANK
2021-04-08,Choice Broking to acquire Escorts Securities for Rs 13 cr - The Economic Times,HDFCBANK
2021-04-29,The four-decade decline in global corporate tax rates - The Economic Times,HDFCBANK
2021-04-12,"Half Yearly Results, Half yearly Earnings for KHFM Hospitality - The Economic Times",HDFCBANK
2021-04-27,Over 12.7 lakh PACL investors get their money back: Sebi - The Economic Times,HDFCBANK
2021-04-19,Investment advisers cannot charge implementation fee for advisory clients: Sebi - The Economic Times,HDFCBANK
2021-04-23,How to spot multibaggers? Vijay Kedia gives away his own secret formula - The Economic Times,HDFCBANK
2021-04-14,GR Infraprojects files for IPO to raise Rs 800 crore - ANI News,HDFCBANK
2021-04-10,"India’s First Municipal Green Bond was Issued by Ghaziabad, Uttar Pradesh - AffairsCloud.com",HDFCBANK
2021-04-09,"Sensex drops over 150 points in early trade, Nifty below 14,850 - India TV News",HDFCBANK
2021-05-17,"Sensex surges 848 points, Nifty settles at 14,923 led by banks, financial stocks - The Indian Express",HDFCBANK
2021-05-06,Latest Nifty 50 Stocks & their weights - Invest Yadnya,HDFCBANK
2021-05-18,Federal Bank Reports Highest-Ever Quarterly Net Profit of Rs 4.8 bn - Equitymaster,HDFCBANK
2021-05-27,Burger King India ends 3% lower as firm reports net loss of Rs 26 cr - The Economic Times,HDFCBANK
2021-05-18,"Sensex climbs 613 points, Nifty ends above 15,100 as fresh Covid-19 cases stay below 3-lakh-mark - The Indian Express",HDFCBANK
2021-05-29,Pick-up in specialty sales to push Sun Pharma stock higher - The Economic Times,HDFCBANK
2021-05-29,"Half Yearly Results, Half yearly Earnings for Alfa Ica - The Economic Times",HDFCBANK
2021-06-01,"Top Cryptocurrency Prices Today: Polkadot, Ethereum, Dogecoin gain up to 18% - The Economic Times",HDFCBANK
2021-05-05,"HDB Financial Services IPO from HDFC Bank: Review, Listing Date, Grey Market Price & Allotment - investor academy",HDFCBANK
2021-06-19,"HDFC Bank Outlook for the Week (June 21,2021 – June 25,2021) - Equitypandit",HDFCBANK
2021-06-03,Biggest bank in India torn between BlackRock and funding coal - The Economic Times,HDFCBANK
2021-06-09,"Axis Bank Option Chain (AXISBANK) — Live OI, IV & PCR - NiftyTrader",HDFCBANK
2021-06-12,This Rakesh Jhunjhunwala portfolio share zooms over 32% in one month - Mint,HDFCBANK
2021-06-07,TVS Motor Company Surges 6% - Equitypandit,HDFCBANK
2021-06-29,SBI Mutual Fund launches consumption ETF - Mint,HDFCBANK
2021-06-09,Stock market news: Adani Power shares surge 10% - The Economic Times,HDFCBANK
2021-06-10,Are you averse to booking losses in stocks? It’s best time to remove the weeds - The Economic Times,HDFCBANK
2021-06-04,"A 3-bagger in 9 months, this stock is a play on all those SMSs you receive - The Economic Times",HDFCBANK
2021-07-01,India Pesticides IPO: GMP suggests strong listing of shares - Mint,HDFCBANK
2021-06-03,NSE-BSE bulk deals: HDFC Mutual Fund raises stake in Power Mech - The Economic Times,HDFCBANK
2021-06-23,Sebi bars Sterling Biotech's directors from securities markets on GDR manipulation - The Economic Times,HDFCBANK
2021-06-25,"Focus Business Sol Target Share Price, Focus Business Sol Share Price Forecast - The Economic Times",HDFCBANK
2021-06-23,Sensex @2 lakh in 10 years: Raamdeo explains math behind his projection - The Economic Times,HDFCBANK
2021-06-24,Mukesh Ambani's new plans may lead to a re-rating of Reliance stock - The Economic Times,HDFCBANK
2021-06-19,BharatPe CEO assures PMC Bank depositors as Centrum-BharatPe get in-principle approval from RBI - The Economic Times,HDFCBANK
2021-06-14,"State Bank of India (SBI) Option Chain: Call, Put, Lot Size - NiftyTrader",HDFCBANK
2021-07-18,India's HDFC Bank slides as profit misses on rising provisions - Reuters,HDFCBANK
2021-07-27,"After a lukewarm H1CY21, private banks on cusp of re-rating, say analysts; ICICI, HDFC Bank, Kotak among... - Moneycontrol.com",HDFCBANK
2021-07-06,HDFC Bank Gains After Reporting 14% Rise in Loan Book - Equitymaster,HDFCBANK
2021-07-04,The race to become the Vanguard of India’s stock market is on - The Economic Times,HDFCBANK
2021-07-16,Broker Defaults Rise to 28 with NSE Expelling 5 More Brokers Since April 2021 - Moneylife,HDFCBANK
2021-07-06,"Sensex snaps two-day winning run, ends marginally lower - The Indian Express",HDFCBANK
2021-07-06,Arcadia Share declared as defaulter; investors can claim within 3 months - BusinessLine,HDFCBANK
2021-07-09,"Market Roundup: Sensex ends 182 points lower, Nifty closes at 15,689; today’s top gainers and losers - Firstpost",HDFCBANK
2021-07-19,HDFC Bank Earnings Miss Estimates Due to Sharp Rise in Gross NPAs. Stock Falls 4% - Equitymaster,HDFCBANK
2021-07-23,NSE-BSE bulk deals: Maven India Fund sells stake in ANI Integrated Services - The Economic Times,HDFCBANK
2021-07-26,ICICI Bank's Quarterly Results Sends Stock to 52-Week High - Equitymaster,HDFCBANK
2021-07-03,'Father of momentum investing’ shares tips for stock picking - The Economic Times,HDFCBANK
2021-07-07,Why are Tata Motors shares falling? - Mint,HDFCBANK
2021-07-28,"JM Financial initiates coverage on Zomato with 'buy', sees 28% upside - The Economic Times",HDFCBANK
2021-07-30,"Windlas Biotech Balance Sheets, Financial Statements - The Economic Times",HDFCBANK
2021-07-14,"Debt can follow when you use credit cards for bills, spends; Know this before spending - The Economic Times",HDFCBANK
2021-07-07,"Nifty forms a Gravestone Doji candle; analysts see crucial support at 15,635 - The Economic Times",HDFCBANK
2021-07-23,"Zomato share makes strong market debut, lists at 52% premium to issue price - Business Today",HDFCBANK
2021-08-23,HDFC Bank Plans to Issue 3 Lakh Credit Cards in One Month - Equitypandit,HDFCBANK
2021-08-18,HDFC Bank share price: Motilal Oswal sees strong upside as RBI eases restrictions - Mint,HDFCBANK
2021-08-04,India ETFs Hit Record High Ahead of Central Bank Meeting - Investopedia,HDFCBANK
2021-08-31,"Sensex tops 57K-mark for the first time, Nifty nears 17,000; GDP data awaited - The Economic Times",HDFCBANK
2021-08-24,Infosys becomes 4th Indian company to touch $100 billion market capitalisation - The Times of India,HDFCBANK
2021-08-19,"C Parthasarathi, Karvy Stock Broking Head, Arrested For Fraud, Securities Norms Violation - NDTV",HDFCBANK
2021-08-24,HDFC Bank offloads 2% stake in CDSL for ₹223 cr - Mint,HDFCBANK
2021-08-27,"FinX Labs opens start-up accelerator at IFSC, GIFT city - BusinessLine",HDFCBANK
2021-08-07,"HDFC Bank Undertakes Maintenance Work, Digital Services to be Hit on THESE Days. Important Update Here - India.Com",HDFCBANK
2021-08-03,Where to invest a million rupees right now? - The Economic Times,HDFCBANK
2021-08-20,Karvy demat scam: Here’s how the scam played out - The Times of India,HDFCBANK
2021-08-18,Sensex ends in red after late sell-off; scales 56k in intra-day trade - The Times of India,HDFCBANK
2021-09-01,Multibagger alert: 46 stocks that delivered up to 340% returns in 2021 - The Economic Times,HDFCBANK
2021-08-30,Goldman Sachs believes Zomato shares could zoom 109% in blue-sky scenario - The Economic Times,HDFCBANK
2021-08-11,"NSE to enable investments in US stocks such as Apple, Facebook and Tesla - Mint",HDFCBANK
2021-08-10,BSE's India INX to allow trading in foreign stocks - Mint,HDFCBANK
2021-08-23,HDFC Bank Aims to Issue 5 lakh Credit Card a Month Soon. A Look at its Mega Comeback Plan - News18,HDFCBANK
2021-08-31,Avantha Power lenders ink Jhabua Plant deal with NTPC - The Economic Times,HDFCBANK
2021-08-04,"Large Cap pushes Sensex, Nifty to new highs, small and mid-cap declines - Vibes Of India",HDFCBANK
2021-08-21,"God, money and YOLO: How Ark Invest's Cathie Wood found her flock - The Economic Times",HDFCBANK
2021-08-05,SBI customers alert! No online banking services available during this time - Mint,HDFCBANK
2021-08-31,"Sensex zoomed 31,000 pts from March 2020 lows, but broader market still took the cake - The Economic Times",HDFCBANK
2021-08-18,Stock Market NSE BSE Nifty Today: Check Share Market Update - India.Com,HDFCBANK
2021-08-11,"After tepid 2020, unlock, export bets help Vijay Kedia turn the tables - The Economic Times",HDFCBANK
2021-08-20,"Stock Market Updates: Sensex down 400 points, Nifty slips below 16,400; Tata Steel tanks 4% - Business Today",HDFCBANK
2021-09-30,"HDFC Bank didn't flag forgery but levied fees, alleges whistleblower - CNBC TV18",HDFCBANK
2021-09-30,HDFC Bank raises Rs 739 crore via masala bond - The Times of India,HDFCBANK
2021-09-22,"Sensex declines 78 points; Nifty ends below 17,550 - The New Indian Express",HDFCBANK
2021-09-16,Day trading guide: 2 stock recommendations for Friday - The Economic Times,HDFCBANK
2021-09-25,"ED freezes Rs 700 crore worth of Karvy shares held by C Parthasarathy, his sons - The News Minute",HDFCBANK
2021-09-24,"Sensex Crosses 60,000-Mark for First Time; India is Now World's 6th Biggest Stock Market - India.Com",HDFCBANK
2021-09-14,"Stock Market Updates: Sensex up 200 points, Nifty above 17,400; Tech Mahindra, Tata Steel top gainers; Zee Entertainment in focus - Business Today",HDFCBANK
2021-09-26,ED freezes Rs 700 crore worth shares of Karvy CMD & kin - The Times of India,HDFCBANK
2021-09-25,"After losing 18 kg, the Big Bull is ready to fly, scoffs at the skeptics - The Economic Times",HDFCBANK
2021-09-11,Multibagger stock: ₹1 lakh becomes ₹8 crore in 20 years in this share - Mint,HDFCBANK
2021-09-02,"Bulls come roaring back. Now, analysts eye 17,500 levels for Nifty - Mint",HDFCBANK
2021-09-20,Govt sells 6.35% stake in Hindustan Copper to non-retail bidders in OFS - Business Today,HDFCBANK
2021-09-06,Bank of Kigali profit up to Sh2.5bn on interest income - african markets,HDFCBANK
2021-10-19,₹1 lakh to ₹1.7 crore: This multibagger stock gave 16950% return in 22 years - Mint,HDFCBANK
2021-10-13,"HDFC Bank Q2 Net Profit seen up 18.3% YoY to Rs. 8,888.2 cr: Motilal Oswal - Moneycontrol.com",HDFCBANK
2021-10-16,"HDFC Bank Q2 Results: Lender reports 17.6% jump in net profit at Rs 8,834 cr - The Economic Times",HDFCBANK
2021-10-14,"Stock market highlights: Sensex closes above 61,300; Nifty ends above 18,300; HDFC Bank top gainer, HCL Tech d - CNBC TV18",HDFCBANK
2021-10-16,What Is NSE’s NIFTY 50: List Of NIFTY 50 Companies - Samco,HDFCBANK
2021-10-24,Is this the era of the retail investor? - The Economic Times,HDFCBANK
