Date,headline,Ticker
2020-01-17,Markets at close: How the major indices and stocks fared on Friday - CNBC TV18,RELIANCE
2020-01-20,"Market Wrap, Jan 20: Sensex declines over 400 pts, Nifty slips below 12,300 - Business Standard",RELIANCE
2020-01-15,"Share Market Update: Sensex ends 79 points lower, Nifty at 12,343; IndusInd Bank, Wipro, BPCL top losers - Business Today",RELIANCE
2020-01-01,"Sensex rises over 150 pts on first day of 2020, Nifty above 12,200; RIL top gainer - The Economic Times",RELIANCE
2020-01-30,"Share Market Update: Sensex ends 284 points lower, Nifty at 12,035; YES Bank, RIL, Bajaj Finserv top losers - Business Today",RELIANCE
2020-01-22,Fund house indulging in NAV management? - The Economic Times,RELIANCE
2020-01-02,Share market update: PSU bank shares jump; Indian Bank rises 1% - The Economic Times,RELIANCE
2020-01-27,"Share Market Update: Sensex ends 458 points lower, Nifty at 12,119; metal stocks decline - Business Today",RELIANCE
2020-01-03,D-Mart promoters may sell 5.20% stake via block deal - The Economic Times,RELIANCE
2020-01-28,"Sidbi eyes Rs 4,500 crore exit from Bandhan Bank’s Holding Co - The Economic Times",RELIANCE
2020-01-10,"Govt raises authorised capital of Indian Overseas Bank to Rs 25,000 crore - The Economic Times",RELIANCE
2020-01-27,How Muddy Waters is hammering Indian billionaire’s NMC Health - The Economic Times,RELIANCE
2020-01-20,"Share Market Update: Sensex ends 416 points lower, Nifty at 12,230; Kotak Mahindra Bank falls 4% post Q3 results - Business Today",RELIANCE
2020-01-04,"Vivo S1 Pro with diamond-shaped quad rear camera setup launched in India: Check price, features - Business Today",RELIANCE
2020-02-07,Predatory Pricing — Not only abuse but also proof of dominance - SCC Online,RELIANCE
2020-02-11,"Sensex surges over 400 points, Nifty reclaims 12,100 - The Indian Express",RELIANCE
2020-02-18,"Indus Finance Nine Monthly Results, Nine Monthly Earnings for Indus Finance - The Economic Times",RELIANCE
2020-02-20,"Market Wrap, Feb 20: Sensex down 153 pts, Nifty below 12,100 - Business Standard",RELIANCE
2020-02-01,Big winners of last Budget: Check out the stocks that rallied up to 420% - The Economic Times,RELIANCE
2020-02-05,Apollo Tyres’ investors ignore tepid Q3 as worst may be over - Mint,RELIANCE
2020-02-07,Share market update: Pharma shares advance; Aurobindo Pharma climbs 5% - The Economic Times,RELIANCE
2020-02-28,Sebi chief Ajay Tyagi gets 6-month extension - Mint,RELIANCE
2020-02-24,"India can become premier digital society, Ambani tells Nadella at Microsoft event - The Economic Times",RELIANCE
2020-02-24,Mukesh Ambani sees online gaming as next big thing in India - The Economic Times,RELIANCE
2020-02-14,DMart OFS: Non-retail quota subscribed 3.4 times - The Economic Times,RELIANCE
2020-03-21,COVID-19: Reliance Retail keeps grocery stores open - BusinessLine,RELIANCE
2020-03-11,Tata Motors stock in double digits after 11 years - The Economic Times,RELIANCE
2020-03-31,"Share Market Update: Sensex ends 1,028 points higher, Nifty at 8,597; BPCL top gainer - Business Today",RELIANCE
2020-03-04,"Sensex slips 214 points, Nifty ends at 11,251 coronavirus cases in India jump to 28 - The Indian Express",RELIANCE
2020-03-20,Markets witness sharper m-cap loss than 2008 - The Economic Times,RELIANCE
2020-03-12,"Share Market Update: Sensex ends 2,919 points lower; Nifty at 9,590 as coronavirus pandemic infects global indices - Business Today",RELIANCE
2020-03-26,Stock market to stay open despite 21-day India lockdown - The Economic Times,RELIANCE
2020-03-20,"BSE, NSE, commodity markets to be open even as Mumbai goes into partial shutdown - Mint",RELIANCE
2020-03-17,"Bharti Airtel, Vodafone Idea shares gain as DoT seeks 20-year window for AGR payment - The Economic Times",RELIANCE
2020-03-16,"YES Bank to be excluded from Nifty50, Nifty Bank from March 19 - The Economic Times",RELIANCE
2020-03-25,"Share Market LIVE: Sensex ends 1,861 points higher, Nifty at 8,297; RIL, HDFC Bank, Kotak Bank top performers - Business Today",RELIANCE
2020-04-25,Ambani Family Reshuffled Shares in Reliance Industries Before Facebook Deal - newsclick.in,RELIANCE
2020-04-23,"Jio accepts FB friend request, sells 10% stake for record Rs 43,574 crore - The Times of India",RELIANCE
2020-04-09,NSE to discontinue trading in Nifty IT index derivatives - The Economic Times,RELIANCE
2020-04-29,Trending stocks: Ludlow Jute share price surges over 10% - The Economic Times,RELIANCE
2020-04-14,Coronavirus impact on healthcare sector - The Economic Times,RELIANCE
2020-05-10,#RILRightsIssue Announcement to our esteemed shareholders. - facebook.com,RELIANCE
2020-05-16,'New Reliance for a New India' - The Times of India,RELIANCE
2020-05-16,Reliance Industries’ Rs 53 cr rights issue begins on May 20 - The Statesman,RELIANCE
2020-05-04,"Markets crash as Sensex tumbles over 1,500 points, Nifty below 9,400 - India Today",RELIANCE
2020-05-07,"Sensex falls 242 points, Nifty ends a tad below 9,200; financials, FMCG, banks top laggards - The Indian Express",RELIANCE
2020-05-22,"Sensex, Nifty turn choppy; RIL jumps on KKR deal - The New Indian Express",RELIANCE
2020-05-05,Over 360 stocks in Nifty500 trading below 50 & 200-DMA; what should investors do? - Moneycontrol.com,RELIANCE
2020-05-28,Trending stocks: Indostar Capital Finance shares up over 1% - The Economic Times,RELIANCE
2020-05-27,"Kotak Bank jumps over 5% on QIP launch; floor price set at Rs 1,147.75 per share - The Economic Times",RELIANCE
2020-05-04,Sensex crashes 2002 points on global risk-off move and lockdown extension - The Economic Times,RELIANCE
2020-05-26,Radhakishan Damani- backed Dmart shares drop 5% on Covid-19 warnings - The Economic Times,RELIANCE
2020-05-03,Never bet against America; nothing can stop this nation: Warren Buffett - The Economic Times,RELIANCE
2020-05-08,Indian government had Rs 1.66 trillion outstanding loans from RBI in May 1 week - The Economic Times,RELIANCE
2020-05-18,"Share Market Update: Sensex ends 1,068 points lower, Nifty at 8,823; IndusInd Bank, Zee Ent top losers - Business Today",RELIANCE
2020-05-31,RIL- REs: Big game window opens Monday - Kalinga TV,RELIANCE
2020-05-06,"Stock Market Today: Sensex, Nifty continue to trade weak; Oil, gas, energy stocks dip - Zee Business",RELIANCE
2020-06-19,Latham & Watkins Advises on US$7 Billion Reliance Industries Rights Offering - Latham & Watkins LLP,RELIANCE
2020-06-08,"Did the Government Help Reliance Industries Raise Rs 53,000 crore? - newsclick.in",RELIANCE
2020-06-16,Reliance Industries' partly paid share price more than doubles on debut - Business Standard,RELIANCE
2020-06-22,Reliance Industries 1st Indian company to hit $150 billion market cap; Mukesh Ambani in world's top 10 richest - Business Today,RELIANCE
2020-06-05,View: NSE lies the head that bears the bourse - The Economic Times,RELIANCE
2020-06-15,"Sensex losses 700 points, Nifty below 9,800 - ET Auto",RELIANCE
2020-06-15,Day traders ruling the markets - The Hans India,RELIANCE
2020-06-15,Reliance Industries' rights issue share debuts at Rs 690 - Business Today,RELIANCE
2020-06-05,"Stocks in focus: RIL, SBI, Larsen & Toubro, Bharti Airtel, RITES, Power Grid to remain in news - financialexpress.com",RELIANCE
2020-06-08,"Share Market Update: Sensex ends 83 points higher, Nifty at 10,167; Axis Bank, IndusInd Bank, BPCL, IOC top performers - Business Today",RELIANCE
2020-07-22,"Reliance Industries shares hit Rs 2,000-mark, up 130% from March lows - CNBC TV18",RELIANCE
2020-07-28,How India's Oil Major Became Bigger Than Exxon - Crude Oil Prices Today | OilPrice.com,RELIANCE
2020-07-25,"RIL on a roll, now partly-paid shares top rights issue price - The Economic Times",RELIANCE
2020-07-09,Small price stocks in the share market - CAclubindia,RELIANCE
2020-07-14,"Net Worth Of Mukesh Ambani Is Now Higher Than Warren Buffett, Larry Page And Elon Musk! - Dazeinfo",RELIANCE
2020-07-03,"RIL gains as Jio receives 12th cheque worth Rs 1,895 crore - The Economic Times",RELIANCE
2020-07-13,Jhunjhunwala gives away his multibagger hunt formula - The Economic Times,RELIANCE
2020-07-24,Mukesh Ambani's Reliance Industries market valuation crosses Rs 14 lakh crore-mark - India TV News,RELIANCE
2020-07-16,Mukesh Ambani to steer Reliance Industries to a green future; cut in CO2 emission top priority - Business Today,RELIANCE
2020-07-17,"Sensex rallies 548 points; Reliance, HDFC Bank spurt nearly 4 per cent - India TV News",RELIANCE
2020-08-14,"Reliance Industries share top gainer on NSE, BSE today; here's why - Business Today",RELIANCE
2020-09-16,Reliance Industries scales market capitalisation of Rs 16 lakh crore for first time - Business Today,RELIANCE
2020-09-22,Advent Stock Broking fined for violating norms in use of NSE co-location facility - The Economic Times,RELIANCE
2020-10-23,"Sensex rises 200 points, Nifty nears 11,950; Reliance Power surges 14% - The Economic Times",RELIANCE
2020-10-09,"Share Market Highlights: Sensex ends 326 points higher, Nifty at 11,914 as RBI keeps repo rate unchanged at 4% - Business Today",RELIANCE
2020-10-13,Stock market news: IndusInd Bank shares up nearly 1% - The Economic Times,RELIANCE
2020-10-11,"Rakesh Jhunjhunwala reveals his pearls of wisdom, asks Robinhoods to stop trading​​ - The Economic Times",RELIANCE
2020-10-19,What made Upstox India’s second largest stockbroker after Zerodha - The Economic Times,RELIANCE
2020-10-12,"Sensex jumps nearly 400 points in early trade; Nifty tops 12,000 - India TV News",RELIANCE
2020-11-23,RIL and Future Group stocks rally on strong demand - The Indian Express,RELIANCE
2020-11-03,Explainer: What Led to the RIL Stock Price Rout - TheWire.in,RELIANCE
2020-11-27,"Sensex sheds 110 pts, Nifty ends at 12,969; RIL, IT stocks weigh - The Economic Times",RELIANCE
2020-11-06,"RIL shares jump over 3 per cent after Saudi Arabia’s PIF invests Rs 9,555 crore in Reliance Retail - The Indian Express",RELIANCE
2020-11-02,Stock market update: 11 stocks hit 52-week lows on NSE - The Economic Times,RELIANCE
2020-11-25,Reliance vs Amazon: NSE warned Future Retail of action over disclosures - The Economic Times,RELIANCE
2020-12-01,"Buy or Sell: Stock ideas by experts for December 01, 2020 - The Economic Times",RELIANCE
2020-11-27,NSE declares Anugrah Stock & Broking as defaulter - The Economic Times,RELIANCE
2020-11-24,"After NSE, BSE declares Karvy Stock Broking as defaulter, terminates membership - The Economic Times",RELIANCE
2020-11-20,"Gland Pharma shares make a strong debut, jump nearly 23% - Mint",RELIANCE
2020-11-17,"Navneet Munot quits, SBI MF says second-rung fit to run the show - The Economic Times",RELIANCE
2020-11-06,Sensex jumps over 200 points in early trade; Reliance jumps 3 pc - India TV News,RELIANCE
2021-01-01,"RPL case: Sebi fines Reliance Industries, Mukesh Ambani, two other entities - The Times of India",RELIANCE
2020-12-08,Reliance shares rise after Mukesh Ambani hits at 5G rollout in second half of 2021 - The Statesman,RELIANCE
2020-12-14,"Indices end at fresh closing highs, Sensex rises 154 points; PSU banks, metals shine - The Indian Express",RELIANCE
2020-12-21,"D-Street's worst day in 7 months as investors lost Rs 1,850 crore per minute - The Economic Times",RELIANCE
2020-12-20,India seeing multiple monopolistic trends: Prevention better than cure - The Economic Times,RELIANCE
2020-12-29,TCS 2nd Indian firm to top Rs 11 lakh crore m-cap - The Economic Times,RELIANCE
2020-12-02,Tilaknagar Industries settles its dues with Standard Chartered Bank - The Economic Times,RELIANCE
2020-12-30,Antony Waste Handling Cell IPO share allotment finalised. How to check - Mint,RELIANCE
2021-01-27,"Sensex falls 938 points, Nifty settles below 14,000 weighed by HDFC twins and RIL - The Indian Express",RELIANCE
2021-01-27,"Energy sector hit by COVID-19, price stability crucial: Mukesh Ambani at Saudi's FII conference - Moneycontrol.com",RELIANCE
2021-01-02,"SEBI Imposes Rs70 Crore Penalty on Reliance Industries, Mukesh Ambani for Fraudulent Trading in F&O of RPL in 2007 - Moneylife",RELIANCE
2021-01-11,Weightage of each stock in new Nifty Fin Services Index based on free-float M-cap: Ravi Varanasi - The Economic Times,RELIANCE
2021-01-06,"Sensex snaps 10-session winning run, drops 264 pts - ETV Bharat",RELIANCE
2021-01-22,"Domestic markets end lower as banks, metals drag - India Today",RELIANCE
2021-01-25,"Sensex falls 531 points, Nifty ends below 14,250-mark; RIL slips over 5% - The Indian Express",RELIANCE
2021-01-12,NSE-BSE bulk deals: LTS Investment buys stake in Bliss GVS and other deals - The Economic Times,RELIANCE
2021-01-14,Sensex and Nifty end at fresh record highs; TCS jumps 3% - The Indian Express,RELIANCE
2021-01-21,NSE acquires market data terminal firm Cogencis - The Economic Times,RELIANCE
2021-01-09,5 pharma stocks that more than doubled money in one year - The Economic Times,RELIANCE
2021-01-13,Govt to sell up to 10% equity in SAIL through offer for sale - The Economic Times,RELIANCE
2021-01-11,"Sensex rallies 487 points to close above 49,000 for first time; IT stocks shine - The New Indian Express",RELIANCE
2021-01-27,"Amazon tries to block Future's retail asset sale, seeks Kishore Biyani's detention - ETLegalWorld.com",RELIANCE
2021-01-29,Complex drugs to drive further growth: Lupin management - The Economic Times,RELIANCE
2021-01-12,"Sensex slips over 100 points in early trade; Nifty tests 14,450 - The New Indian Express",RELIANCE
2021-01-21,"Market wealth zooms past Rs 199 lakh crore as Sensex scales 50,000 mark - Business Today",RELIANCE
2021-01-25,TCS briefly beats Accenture to become most-valued IT company of the world - Business Today,RELIANCE
2021-02-24,"BSE, NSE extends trading hours till 5 pm today - The Economic Times",RELIANCE
2021-02-26,"Mayhem in Dalal Street: Sensex crashes 1,939 points, Nifty ends below 14,550 amid global selloff - The Indian Express",RELIANCE
2021-02-09,India Inc's billion-dollar club grows to 302 - Business Today,RELIANCE
2021-02-24,"Sensex jumps over 200 points in early trade; Nifty tops 14,750 - The New Indian Express",RELIANCE
2021-02-27,Which financial ratios tell you best about the health of a bank - The Economic Times,RELIANCE
2021-02-08,"Markets scale fresh peaks; Sensex rallies 617 points to close above 51,000-mark - The New Indian Express",RELIANCE
2021-02-18,"Share Market Highlights: Sensex ends 379 points lower, Nifty at 15,118; Maruti, TCS, Axis Bank top losers - Business Today",RELIANCE
2021-02-26,HDFC Mutual fund sells 2.73% stake in Just Dial for over Rs 108 crore - The Economic Times,RELIANCE
2021-02-19,"Share Market Highlights: Sensex ends 434 points lower, Nifty at 14,981; ONGC, SBI, Axis Bank top losers - Business Today",RELIANCE
2021-02-22,Investing in the crypto market: Here’s everything you need to know - The Economic Times,RELIANCE
2021-03-25,Reliance Industries Limited Financial Statements – NSE:RELIANCE - TradingView,RELIANCE
2021-03-26,"Reliance to sell stakes in DEN, Hathway via OFS to meet SEBI norms - Exchange4Media",RELIANCE
2021-03-10,"DRC Systems India lists on BSE, NSE - The Economic Times",RELIANCE
2021-03-04,Sensex slips nearly 600 points amid weak global cues - The Indian Express,RELIANCE
2021-03-15,"Sensex tanks 397 points; Nifty slips below 15,000 - The New Indian Express",RELIANCE
2021-03-26,Bank Nifty vs Nifty Fin Services: Where to invest your money? - The Economic Times,RELIANCE
2021-03-22,Start ops from disaster recovery site within 45 minutes of tech glitch: Sebi tells MIIs - The Economic Times,RELIANCE
2021-03-08,Muthoot Finance plunges 7% after Chairman MG George Muthoot dies - The Economic Times,RELIANCE
2021-03-26,KKR-led consortium invests $234 million in Five-Star Business Finance - The Economic Times,RELIANCE
2021-03-12,BNP Paribas Cardif offloads 5% stake in SBI Life - The Economic Times,RELIANCE
2021-03-12,"Rupa & Co Nine Monthly Results, Nine Monthly Earnings for Rupa & Co - The Economic Times",RELIANCE
2021-04-22,"Happy 25th Birthday, Nifty50! So what has changed & what hasn’t - The Economic Times",RELIANCE
2021-04-23,"Nifty turns 25: Here's how the index progressed from 1,000 to 14,000 - Business Standard",RELIANCE
2021-04-12,"Sensex crashes 1,708 pts as virus wave hammers Street - The Indian Express",RELIANCE
2021-04-12,"Share Market Today: BSE Sensex Crashes Over 1400 Points, NSE Nifty Plunges 431 Points - India.Com",RELIANCE
2021-04-21,"Merger of TV18 Broadcast, Hathway Cable and Den Networks with Network18 Media cancelled - CNBC TV18",RELIANCE
2021-04-13,"Prabhat Dairy to be delisted from BSE, NSE on April 30 - The Economic Times",RELIANCE
2021-04-29,Sensex and Nifty end marginally higher on F&O expiry - The Indian Express,RELIANCE
2021-04-26,"Sensex gains 508 points, Nifty ends near 14,500; Axis Bank climbs 4% - The Economic Times",RELIANCE
2021-04-08,Choice Broking to acquire Escorts Securities for Rs 13 cr - The Economic Times,RELIANCE
2021-04-29,The four-decade decline in global corporate tax rates - The Economic Times,RELIANCE
2021-04-19,Investment advisers cannot charge implementation fee for advisory clients: Sebi - The Economic Times,RELIANCE
2021-04-23,How to spot multibaggers? Vijay Kedia gives away his own secret formula - The Economic Times,RELIANCE
2021-04-05,"Maruti Suzuki India, Adani Enterprises, Reliance industries, and more: Top stocks in focus today. - True Scoop",RELIANCE
2021-04-09,"Sensex drops over 150 points in early trade, Nifty below 14,850 - India TV News",RELIANCE
2021-05-13,Our latest posting on #ReliancePP on the SEs is shared: https://bit.ly/3uO6OEf #RILPP - facebook.com,RELIANCE
2021-05-06,Latest Nifty 50 Stocks & their weights - Invest Yadnya,RELIANCE
2021-05-18,"Buy or Sell: Stock ideas by experts for May 18, 2021 - The Economic Times",RELIANCE
2021-05-31,"Nifty soars to fresh peak on recovery hopes; RIL, banks lend support - orissapost.com",RELIANCE
2021-05-10,NSE/BSE Listed Companies Starting From R - Equitypandit,RELIANCE
2021-05-16,Options data points to range-bound trading - The Hans India,RELIANCE
2021-05-08,"Emergency approval for DRDO's anti-Covid drug 2-DG; trials claim reduced oxygen dependence, faster recovery - The Economic Times",RELIANCE
2021-05-17,"Sensex jumps 848 points, Nifty above 14,900; VIX eases 3% - The Economic Times",RELIANCE
2021-05-30,Zerodha co-founders not drawing Rs 100 crore salaries: Nithin Kamath - The Economic Times,RELIANCE
2021-06-11,Sensex and Nifty settle at lifetime highs - The Indian Express,RELIANCE
2021-06-16,Top performing mutual funds make winning bets on chemical stocks - The Economic Times,RELIANCE
2021-06-25,What Reliance’s push towards green hydrogen power means for India’s EV ecosystem - Moneycontrol.com,RELIANCE
2021-06-09,Stock market news: Adani Power shares surge 10% - The Economic Times,RELIANCE
2021-06-12,This Rakesh Jhunjhunwala portfolio share zooms over 32% in one month - Mint,RELIANCE
2021-06-24,Mukesh Ambani's new plans may lead to a re-rating of Reliance stock - The Economic Times,RELIANCE
2021-06-29,SBI Mutual Fund launches consumption ETF - Mint,RELIANCE
2021-06-23,Sebi bars Sterling Biotech's directors from securities markets on GDR manipulation - The Economic Times,RELIANCE
2021-06-10,Are you averse to booking losses in stocks? It’s best time to remove the weeds - The Economic Times,RELIANCE
2021-06-27,How investing in edtech startups can combine profit with purpose - The Economic Times,RELIANCE
2021-06-24,RIL AGM 2021: Deal on cards? Saudi Aramco chairman Yasir al-Rumayyan joins Reliance board - The Economic Times,RELIANCE
2021-06-16,Malabar Group's overseas arm lists on Nasdaq Dubai Private Market - The Economic Times,RELIANCE
2021-06-24,JioPhone Next: Mukesh Ambani announces ‘most affordable’ smartphone partnered with Google to make India 2... - The Economic Times,RELIANCE
2021-06-23,Sensex @2 lakh in 10 years: Raamdeo explains math behind his projection - The Economic Times,RELIANCE
2021-06-15,"Ruchi Soya acquires biscuits, noodles business of Patanjali ahead of FPO - The Economic Times",RELIANCE
2021-06-02,"ET Stock Reports - Get Trading Ideas, In-Depth Stock Analysis | ET Stock reports benefits - The Economic Times",RELIANCE
2021-07-20,NSE VS BSE | How NSE Beat BSE to Become India's Top Stock Exchange - marketfeed,RELIANCE
2021-07-21,Know which funds own a particular stock - Morningstar India,RELIANCE
2021-07-06,"Sensex snaps two-day winning run, ends marginally lower - The Indian Express",RELIANCE
2021-07-04,The race to become the Vanguard of India’s stock market is on - The Economic Times,RELIANCE
2021-07-23,"Zomato delivers a delicious listing on D-Street, m-cap breaches Rs 1 lakh cr mark - The Economic Times",RELIANCE
2021-07-07,Why are Tata Motors shares falling? - Mint,RELIANCE
2021-07-31,"How to value a loss-making business with large market, scaling prospects - The Economic Times",RELIANCE
2021-07-03,'Father of momentum investing’ shares tips for stock picking - The Economic Times,RELIANCE
2021-07-14,"If Zomato was a movie, you have only watched the trailer, say co-founder Gaurav Gupta - The Economic Times",RELIANCE
2021-07-01,The man who started the $11 trillion index revolution - The Economic Times,RELIANCE
2021-07-14,"PMC Fincorp share price manipulation case: Two accused pay Rs 61 lakh settlement amount, settle case - The Economic Times",RELIANCE
2021-07-03,Zomato IPO: Decks clear for listing as food delivery platform gets SEBI apporoval - The Economic Times,RELIANCE
2021-07-19,GR Infraprojects lists at 105% premium over issue price - The Economic Times,RELIANCE
2021-07-15,Sebi exempts family trust linked to Capri Global Capital's promoters from open offer obligations - The Economic Times,RELIANCE
2021-07-04,Delhi: Chilla village residents face acute water crisis amid scorching heat - The Economic Times,RELIANCE
2021-07-30,"Windlas Biotech Balance Sheets, Financial Statements - The Economic Times",RELIANCE
2021-08-04,India ETFs Hit Record High Ahead of Central Bank Meeting - Investopedia,RELIANCE
2021-08-24,Infosys becomes 4th Indian company to touch $100 billion market capitalisation - The Times of India,RELIANCE
2021-08-18,TCS 2nd Indian company after RIL to cross Rs 13 lakh crore m-cap - The Economic Times,RELIANCE
2021-08-24,Infosys Becomes Fourth Company to Hit US$100 bn Marketcap. What's Fuelling the Rally? - Equitymaster,RELIANCE
2021-09-01,Reliance New Energy Solar Ltd To Invest USD 144 Million In Ambri Inc. - Goodreturns,RELIANCE
2021-08-10,"Sensex surges over 250 pts in early trade; Nifty tops 16,300 - The Times of India",RELIANCE
2021-08-03,Where to invest a million rupees right now? - The Economic Times,RELIANCE
2021-08-10,BSE's India INX to allow trading in foreign stocks - Mint,RELIANCE
2021-08-02,Adani floats company for petrochemical foray - Moneycontrol.com,RELIANCE
2021-08-31,"Sensex tops 57K-mark for the first time, Nifty nears 17,000; GDP data awaited - The Economic Times",RELIANCE
2021-08-24,6 stocks with high financial leverage - Mint,RELIANCE
2021-08-30,Goldman Sachs believes Zomato shares could zoom 109% in blue-sky scenario - The Economic Times,RELIANCE
2021-08-31,Avantha Power lenders ink Jhabua Plant deal with NTPC - The Economic Times,RELIANCE
2021-08-11,"Stocks in focus: Powergrid, Trent, Zomato and more - The Economic Times",RELIANCE
2021-08-31,Sensex rallies 663 pts to close above 57k-mark; Nifty scales 17k - The Times of India,RELIANCE
2021-08-31,"Stock Market NSE BSE Share Market Today: Sensex Scales 57,000 For First Time, Nifty50 Nears 17,000 - India.Com",RELIANCE
2021-08-30,BNP Paribas names Sanjay Singh as CEO of India operations - The Economic Times,RELIANCE
2021-08-18,HDFC Bank share price: Motilal Oswal sees strong upside as RBI eases restrictions - Mint,RELIANCE
2021-08-04,"Large Cap pushes Sensex, Nifty to new highs, small and mid-cap declines - Vibes Of India",RELIANCE
2021-08-24,All you need to know about peer-to-peer lending - Mint,RELIANCE
2021-08-09,Sona Comstar gains 17% after strong June quarter performance - Mint,RELIANCE
2021-08-24,"Chemplast Sanmar shares list at loss, debut at discount to IPO price; open at Rs 525 - financialexpress.com",RELIANCE
2021-09-27,"Reliance Industries shares hit record high, above ₹2500. Good time to buy? - Mint",RELIANCE
2021-09-12,How Many HFCL Limited (NSE:HFCL) Shares Do Institutions Own? - simplywall.st,RELIANCE
2021-09-17,"Sensex gains 350 points, Nifty hits 17,700; Biocon jumps 3% - The Economic Times",RELIANCE
2021-09-15,"Sensex, Nifty rise in early trade on sustained foreign fund inflows - The New Indian Express",RELIANCE
2021-09-24,"Sensex journey to 60,000: Explained in 10 charts - The Times of India",RELIANCE
2021-09-14,"Stock Market Updates: Sensex up 200 points, Nifty above 17,400; Tech Mahindra, Tata Steel top gainers; Zee Entertainment in focus - Business Today",RELIANCE
2021-09-02,"Bulls come roaring back. Now, analysts eye 17,500 levels for Nifty - Mint",RELIANCE
2021-09-20,"Sensex tanks 525 points, Nifty ends below 17,400; Tata Steel tumbles 10% - The Economic Times",RELIANCE
2021-09-30,"Out of PCA framework, IOB jumps 20%; Central Bank rises 11% on similar hope - The Economic Times",RELIANCE
2021-09-11,Multibagger stock: ₹1 lakh becomes ₹8 crore in 20 years in this share - Mint,RELIANCE
2021-09-03,"Sensex crosses 58K, gains 250 pts; Nifty tops 17,300; banks, auto, metals rally - The Economic Times",RELIANCE
2021-09-18,NSE mulls discontinuing stop loss market orders for options - The Economic Times,RELIANCE
2021-10-01,NIIT acquires 70% stake in RPS Consulting for Rs 82.3 cr - The Economic Times,RELIANCE
2021-09-30,"Not just drugs, Alkem Labs churns out crorepatis in heaps as well - The Economic Times",RELIANCE
2021-09-27,"Nifty may head to 18200 in October, Bank Nifty to hit 38600; RIL, Infosys, others among top money-making ideas - financialexpress.com",RELIANCE
2021-10-16,What Is NSE’s NIFTY 50: List Of NIFTY 50 Companies - Samco,RELIANCE
